title,media_type,release_date,popularity,overview,language,vote_count,release_year,genres
Derren Brown: Sacrifice,movie,2018-10-19,0.2657,Illusionist Derren Brown concocts a psychological experiment in which he tries to manipulate an ordinary person into taking a bullet for a stranger.,en,52,2018,"['Documentary', 'Mystery']"
Little Miss Sumo,movie,2018-10-18,0.2594,"In an ancient sport traditionally reserved for men, 20-year-old female sumo prodigy Hiyori attempts to revolutionize Japan’s national pastime.",en,39,2018,['Documentary']
Tom Segura: Disgraceful,movie,2018-01-12,0.2495,"Tom Segura gives voice to the sordid thoughts you'd never say out loud, with blunt musings on porn, parking lot power struggles, parenthood and more.",en,73,2018,['Comedy']
Jim Jefferies: This Is Me Now,movie,2018-07-13,0.2422,"The gleefully irreverent Jefferies skewers “grabby” celebrities, political hypocrisy and his own ill-advised career moves in a brash stand-up special.",en,104,2018,['Comedy']
The Delivery Boy,movie,2018-05-24,0.2361,"A runaway, teenage, suicide bomber and his newfound ally, a young prostitute, must rely on each other to survive the night while searching for answers to the terrible secrets that made them who they are.",en,7,2018,"['Drama', 'Thriller']"
Lionheart,movie,2018-09-08,0.2337,"In order to save her father's ailing bus company, competent but perennially overlooked Adaeze must find a way to work alongside feckless uncle Godswill.",en,32,2018,"['Drama', 'Comedy']"
Gad Elmaleh: American Dream,movie,2018-03-06,0.2233,"In his first English-language special, comedian Gad Elmaleh gleefully digs into America's food obsessions, dating culture, slang, and more.",en,102,2018,['Comedy']
Kevin James: Never Don't Give Up,movie,2018-04-24,0.2122,"Kevin James makes his long-awaited return to stand-up in this family-friendly special, dishing on fatherhood, fans, his disdain for allergies and more.",en,44,2018,"['Comedy', 'TV Movie']"
Hari Kondabolu: Warn Your Relatives,movie,2018-05-08,0.2085,"Hari Kondabolu breaks down identity politics, celebrity encounters, his mango obsession and more in an unpredictable stand-up comedy special.",en,16,2018,['Comedy']
"Out of Many, One",movie,2018-12-12,0.2067,"The U.S. has long offered a promise of opportunity to immigrants, but currently immigration has become a divisive issue. This documentary illustrates how an understanding of our history and democracy is essential to constructive debate, informed civic participation and shaping a new class of citizens.",en,14,2018,['Documentary']
W. Kamau Bell: Private School Negro,movie,2018-06-26,0.2045,"Comedian W. Kamau Bell muses on parenting in the Trump era, ""free speech"" dustups, woke children's TV and his fear of going off the grid.",en,19,2018,['Comedy']
D.L. Hughley: Contrarian,movie,2018-09-18,0.202,"Comedian D.L. Hughley riffs on politics, ""Black Panther,"" his upbringing and more in a rapid-fire stand-up show at Philadelphia's Merriam Theater.",en,16,2018,"['Comedy', 'Documentary', 'TV Movie']"
Tig Notaro: Happy to Be Here,movie,2018-05-22,0.2011,"Comedian Tig Notaro unleashes her inner prankster in a playful stand-up special packed with funny anecdotes, parenting confessions and more.",en,50,2018,['Comedy']
Up North,movie,2018-12-28,0.1929,A young rebellious heir from a wealthy family is sent away to National Service in Northern Nigeria. Things don't quite go according to plan as the spoiled heir begins to find himself.,en,5,2018,['Drama']
Recovery Boys,movie,2018-05-01,0.1852,"In the heart of America's opioid epidemic, four men try to reinvent their lives and mend their broken relationships after years of drug abuse.",en,16,2018,['Documentary']
Mercury 13,movie,2018-04-08,0.1802,"After rigorous testing in 1961, a small group of skilled female pilots are asked to step aside when only men are selected for spaceflight.",en,56,2018,['Documentary']
Vir Das: Losing It,movie,2018-12-11,0.1748,"The world's got a lot of problems, but Vir Das has a lot of answers as he discusses travel, religion, his childhood and more in this stand-up special.",en,31,2018,['Comedy']
"Ron White: If You Quit Listening, I'll Shut Up",movie,2018-10-16,0.1681,"Ron ""Tater Salad"" White dishes out his signature brand of cynicism, riffing on sex, celebrity and the sinister habits of wild geese.",en,34,2018,['Comedy']
Greg Davies: You Magnificent Beast,movie,2018-04-10,0.1402,"Greg is back with his first stand up show in four years, and biggest ever tour, You Magnificent Beast.",en,44,2018,['Comedy']
Fakkah Fuzz: Almost Banned,movie,2018-01-26,0.1308,Stand-up comic Fakkah Fuzz mines cross-cultural humor from the experience of growing up as an outspoken Malay man in Singapore.,en,7,2018,['Comedy']
Fary Is the New Black,movie,2018-04-03,0.1261,"Armed with sly wit, a fresh outlook and plenty of style, French comedy star Fary veers from dating to stereotypes and beyond in this exclusive special.",en,92,2018,['Comedy']
Kavin Jay : Everybody Calm Down!,movie,2018-02-02,0.1108,"On a mission to defy stereotypes, Malaysian stand-up comedian Kavin Jay shares stories about growing up in the VHS era with his Singapore audience.",en,8,2018,"['Comedy', 'Documentary']"
Harith Iskander: I Told You So,movie,2018-01-19,0.1081,"Malaysian stand-up comedy icon Harith Iskander takes the stage in Kuala Lumpur to talk about Singapore, a past girlfriend, and Rick Astley.",en,5,2018,['Comedy']
John Wick: Chapter 3 - Parabellum,movie,2019-05-15,50.0284,"Super-assassin John Wick returns with a $14 million price tag on his head and an army of bounty-hunting killers on his trail. After killing a member of the shadowy international assassin’s guild, the High Table, John Wick is excommunicado, but the world’s most ruthless hit men and women await his every turn.",en,11013,2019,"['Action', 'Thriller', 'Crime']"
Spider-Man: Far From Home,movie,2019-06-28,34.8762,"Peter Parker and his friends go on a summer trip to Europe. However, they will hardly be able to rest - Peter will have to agree to help Nick Fury uncover the mystery of creatures that cause natural disasters and destruction throughout the continent.",en,16106,2019,"['Action', 'Adventure', 'Science Fiction']"
Ready or Not,movie,2019-08-21,24.6083,A young bride's wedding night turns into her worst nightmare when her ridiculously rich in-laws force her to play a gruesome game of hide-and-seek.,en,4818,2019,"['Horror', 'Comedy']"
After,movie,2019-04-11,22.6383,"Tessa Young is a dedicated student, dutiful daughter and loyal girlfriend to her high school sweetheart. Entering her first semester of college, Tessa's guarded world opens up when she meets Hardin Scott, a mysterious and brooding rebel who makes her question all she thought she knew about herself -- and what she wants out of life.",en,8349,2019,"['Romance', 'Drama']"
Joker,movie,2019-10-01,17.9067,"During the 1980s, a failed stand-up comedian is driven insane and turns to a life of crime and chaos in Gotham City while becoming an infamous psychopathic crime figure.",en,26512,2019,"['Crime', 'Thriller', 'Drama']"
Knives Out,movie,2019-11-27,12.7484,"When renowned crime novelist Harlan Thrombey is found dead at his estate just after his 85th birthday, the inquisitive and debonair Detective Benoit Blanc is mysteriously enlisted to investigate. From Harlan's dysfunctional family to his devoted staff, Blanc sifts through a web of red herrings and self-serving lies to uncover the truth behind Harlan's untimely death.",en,12899,2019,"['Comedy', 'Crime', 'Mystery']"
Once Upon a Time... in Hollywood,movie,2019-07-24,11.9402,"Los Angeles, 1969. TV star Rick Dalton, a struggling actor specializing in westerns, and stuntman Cliff Booth, his best friend, try to survive in a constantly changing movie industry. Dalton is the neighbor of the young and promising actress and model Sharon Tate, who has just married the prestigious Polish director Roman Polanski…",en,13928,2019,"['Comedy', 'Drama', 'Thriller']"
It Chapter Two,movie,2019-09-04,11.1701,"27 years after overcoming the malevolent supernatural entity Pennywise, the former members of the Losers' Club, who have grown up and moved away from Derry, are brought back together by a devastating phone call.",en,8951,2019,"['Horror', 'Thriller']"
Ad Astra,movie,2019-09-17,10.4633,"The near future, a time when both hope and hardships drive humanity to look to the stars and beyond. While a mysterious phenomenon menaces to destroy life on planet Earth, astronaut Roy McBride undertakes a mission across the immensity of space and its many perils to uncover the truth about a lost expedition that decades before boldly faced emptiness and silence in search of the unknown.",en,6811,2019,"['Science Fiction', 'Drama']"
Annabelle Comes Home,movie,2019-06-26,9.7683,"Determined to keep Annabelle from wreaking more havoc, demonologists Ed and Lorraine Warren bring the possessed doll to the locked artifacts room in their home, placing her “safely” behind sacred glass and enlisting a priest’s holy blessing. But an unholy night of horror awaits as Annabelle awakens the evil spirits in the room, who all set their sights on a new target—the Warrens' ten-year-old daughter, Judy, and her friends.",en,3603,2019,['Horror']
Little Women,movie,2019-12-25,9.4047,Four sisters come of age in America in the aftermath of the Civil War.,en,6458,2019,"['Drama', 'Romance', 'History']"
The Irishman,movie,2019-11-01,8.8565,"Pennsylvania, 1956. Frank Sheeran, a war veteran of Irish origin who works as a truck driver, accidentally meets mobster Russell Bufalino. Once Frank becomes his trusted man, Bufalino sends him to Chicago with the task of helping Jimmy Hoffa, a powerful union leader related to organized crime, with whom Frank will maintain a close friendship for nearly twenty years.",en,7052,2019,"['Crime', 'Drama', 'History']"
Terminator: Dark Fate,movie,2019-10-23,8.6851,"Decades after Sarah Connor prevented Judgment Day, a lethal new Terminator is sent to eliminate the future leader of the resistance. In a fight to save mankind, battle-hardened Sarah Connor teams up with an unexpected ally and an enhanced super soldier to stop the deadliest Terminator yet.",en,5308,2019,"['Science Fiction', 'Action', 'Adventure', 'Thriller']"
The Secret Life of Pets 2,movie,2019-05-24,8.6246,"Max the terrier must cope with some major life changes when his owner gets married and has a baby. When the family takes a trip to the countryside, nervous Max has numerous run-ins with canine-intolerant cows, hostile foxes and a scary turkey. Luckily for Max, he soon catches a break when he meets Rooster, a gruff farm dog who tries to cure the lovable pooch of his neuroses.",en,3147,2019,"['Adventure', 'Animation', 'Comedy', 'Family']"
Us,movie,2019-03-14,7.8218,"Husband and wife Gabe and Adelaide Wilson take their kids to their beach house expecting to unplug and unwind with friends. But as night descends, their serenity turns to tension and chaos when some shocking visitors arrive uninvited.",en,7586,2019,"['Horror', 'Mystery', 'Thriller']"
The Angry Birds Movie 2,movie,2019-08-02,7.1943,"Red, Chuck, Bomb and the rest of their feathered friends are surprised when a green pig suggests that they put aside their differences and unite to fight a common threat. Aggressive birds from an island covered in ice are planning to use an elaborate weapon to destroy the fowl and swine.",en,1761,2019,"['Family', 'Comedy', 'Adventure', 'Animation']"
Fractured,movie,2019-09-22,6.855,"Driving cross-country, Ray and his wife and daughter stop at a highway rest area where his daughter falls and breaks her arm. After a frantic rush to the hospital and a clash with the check-in nurse, Ray is finally able to get her to a doctor. While the wife and daughter go downstairs for an MRI, Ray, exhausted, passes out in a chair in the lobby. Upon waking up, they have no record or knowledge of Ray's family ever being checked in.",en,2659,2019,"['Thriller', 'Drama']"
Men in Black: International,movie,2019-06-12,6.6504,"The Men in Black have always protected the Earth from the scum of the universe. In this new adventure, they tackle their biggest, most global threat to date: a mole in the Men in Black organization.",en,5048,2019,"['Comedy', 'Science Fiction', 'Action']"
Zombieland: Double Tap,movie,2019-10-09,6.5886,"Columbus, Tallahassee, Wichita, and Little Rock move to the American heartland as they face off against evolved zombies, fellow survivors, and the growing pains of the snarky makeshift family.",en,5892,2019,"['Comedy', 'Horror', 'Action']"
Angel Has Fallen,movie,2019-08-21,6.002,"After a treacherous attack, Secret Service agent Mike Banning is charged with attempting to assassinate President Trumbull. Chased by his own colleagues and the FBI, Banning begins a race against the clock to clear his name.",en,3617,2019,"['Action', 'Thriller']"
What Men Want,movie,2019-02-08,5.9547,"Magically able to hear what men are thinking, a sports agent uses her newfound ability to turn the tables on her overbearing male colleagues.",en,1486,2019,"['Comedy', 'Romance']"
Ma,movie,2019-05-29,5.8152,"Sue Ann is a loner who keeps to herself in her quiet Ohio town. One day, she is asked by Maggie, a new teenager in town, to buy some booze for her and her friends, and Sue Ann sees the chance to make some unsuspecting, if younger, friends of her own.",en,2313,2019,"['Horror', 'Thriller']"
Inside Man: Most Wanted,movie,2019-09-24,5.7267,An NYPD hostage negotiator teams up with a federal agent to rescue dozens of tourists held hostage during a 10-hour seige at the U.S. Federal Reserve.,en,343,2019,"['Action', 'Crime', 'Thriller']"
Triple Frontier,movie,2019-03-06,5.5656,"Struggling to make ends meet, former special ops soldiers reunite for a high-stakes heist: stealing $75 million from a South American drug lord.",en,3315,2019,"['Action', 'Thriller', 'Crime', 'Adventure']"
Polar,movie,2019-01-25,5.5545,"When a retiring assassin realizes that he is the target of a hit, he winds up back in the game going head to head with a gang of younger, ruthless killers.",en,2291,2019,"['Action', 'Crime', 'Drama']"
El Camino: A Breaking Bad Movie,movie,2019-10-11,5.5316,"In the wake of his dramatic escape from captivity, Jesse Pinkman must come to terms with his past in order to forge some kind of future.",en,5087,2019,"['Crime', 'Drama', 'Thriller']"
6 Underground,movie,2019-12-10,5.2565,"After faking his death, a tech billionaire recruits a team of international operatives for a bold and bloody mission to take down a brutal dictator.",en,4879,2019,"['Action', 'Comedy', 'Thriller']"
Gemini Man,movie,2019-10-02,5.0544,"Henry Brogan is an elite 51-year-old assassin who's ready to call it quits after completing his 72nd job. His plans get turned upside down when he becomes the target of a mysterious operative who can seemingly predict his every move. To his horror, Brogan soon learns that the man who's trying to kill him is a younger, faster, cloned version of himself.",en,5220,2019,"['Science Fiction', 'Action', 'Adventure', 'Thriller']"
Uncut Gems,movie,2019-08-30,4.7548,"A charismatic New York City jeweler always on the lookout for the next big score makes a series of high-stakes bets that could lead to the windfall of a lifetime. Howard must perform a precarious high-wire act, balancing business, family, and encroaching adversaries on all sides in his relentless pursuit of the ultimate win.",en,4941,2019,"['Drama', 'Thriller', 'Crime']"
Murder Mystery,movie,2019-05-25,4.6534,"On a long-awaited trip to Europe, a New York City cop and his hairdresser wife scramble to solve a baffling murder aboard a billionaire's yacht.",en,4539,2019,"['Action', 'Comedy', 'Mystery']"
Tall Girl,movie,2019-09-13,4.6465,"Jodi, the tallest girl in her high school, has always felt uncomfortable in her own skin. But after years of slouching, being made fun of, and avoiding attention at all costs, Jodi finally decides to find the confidence to stand tall.",en,1889,2019,"['Comedy', 'Drama', 'Romance']"
Midway,movie,2019-11-06,4.4861,"The story of the Battle of Midway, and the leaders and soldiers who used their instincts, fortitude and bravery to overcome massive odds.",en,2551,2019,"['Action', 'War', 'History']"
Marriage Story,movie,2019-09-28,4.4095,"A stage director and an actress struggle through a grueling, coast-to-coast divorce that pushes them to their personal extremes.",en,7091,2019,['Drama']
The King,movie,2019-10-11,4.3902,"England, 15th century. Hal, a capricious prince who lives among the populace far from court, is forced by circumstances to reluctantly accept the throne and become Henry V.",en,3330,2019,"['Drama', 'History', 'War']"
Rocketman,movie,2019-05-17,4.1299,"The story of Elton John's life, from his years as a prodigy at the Royal Academy of Music through his influential and enduring musical partnership with Bernie Taupin.",en,4760,2019,"['Music', 'Drama']"
Late Night,movie,2019-01-25,3.8918,"A legendary late-night talk show host's world is turned upside down when she hires her only female staff writer. Originally intended to smooth over diversity concerns, her decision has unexpectedly hilarious consequences as the two women separated by culture and generation are united by their love of a biting punchline.",en,820,2019,"['Comedy', 'Drama']"
Klaus,movie,2019-11-08,3.8788,"When Jesper distinguishes himself as the Postal Academy's worst student, he is sent to Smeerensburg, a small village located on an icy island above the Arctic Circle, where grumpy inhabitants barely exchange words, let alone letters. Jesper is about to give up and abandon his duty as a postman when he meets local teacher Alva and Klaus, a mysterious carpenter who lives alone in a cabin full of handmade toys.",en,4284,2019,"['Animation', 'Family', 'Adventure', 'Comedy', 'Fantasy']"
The Two Popes,movie,2019-11-27,3.7223,"Frustrated with the direction of the church, Cardinal Bergoglio requests permission to retire in 2012 from Pope Benedict. Instead, facing scandal and self-doubt, the introspective Pope Benedict summons his harshest critic and future successor to Rome to reveal a secret that would shake the foundations of the Catholic Church.",en,2969,2019,"['Drama', 'History']"
Serenity,movie,2019-01-24,3.5691,"The quiet life of Baker Dill, a fishing boat captain who lives on the isolated Plymouth Island, where he spends his days obsessed with capturing an elusive tuna while fighting his personal demons, is interrupted when someone from his past comes to him searching for help.",en,1551,2019,"['Thriller', 'Mystery', 'Drama']"
The Last Summer,movie,2019-05-03,3.4775,"Standing on the precipice of adulthood, a group of friends navigate new relationships, while reexamining others, during their final summer before college.",en,1377,2019,"['Romance', 'Comedy']"
Shaft,movie,2019-06-14,3.4179,"JJ, aka John Shaft Jr., may be a cyber security expert with a degree from MIT, but to uncover the truth behind his best friend’s untimely death, he needs an education only his dad can provide. Absent throughout JJ’s youth, the legendary locked-and-loaded John Shaft agrees to help his progeny navigate Harlem’s heroin-infested underbelly.",en,1760,2019,"['Action', 'Crime', 'Comedy', 'Mystery']"
The Silence,movie,2019-05-16,3.4169,"With the world under attack by deadly creatures who hunt by sound, a teen and her family seek refuge outside the city and encounter a mysterious cult.",en,1598,2019,"['Horror', 'Drama', 'Thriller', 'Fantasy']"
Judy,movie,2019-09-27,3.103,"Thirty years after starring in ""The Wizard of Oz,"" beloved actress and singer Judy Garland arrives in London to perform sold-out shows at the Talk of the Town nightclub. While there, she reminisces with friends and fans and begins a whirlwind romance with musician Mickey Deans, her soon-to-be fifth husband.",en,1200,2019,"['Drama', 'History', 'Music']"
In the Tall Grass,movie,2019-09-20,2.924,"After hearing a child screaming for help from the green depths of a vast field of tall grass, Becky, a pregnant woman, and Cal, her brother, park their car near a mysterious abandoned church and enter the field, discovering that they are not alone and, for some reason, they are unable to escape a completely inextricable vegetable labyrinth.",en,2261,2019,"['Horror', 'Drama', 'Thriller']"
Someone Great,movie,2019-04-19,2.909,"An aspiring music journalist lands her dream job and is about to move to San Francisco when her boyfriend of nine years decides to call it quits. To nurse her broken heart, she and her two best friends spend one outrageous last adventure in New York City.",en,1169,2019,"['Comedy', 'Romance']"
Close,movie,2019-02-22,2.8542,"A counter-terrorism expert takes a job protecting a young heiress. After an attempted kidnapping puts both of their lives in danger, they must flee.",en,680,2019,"['Action', 'Adventure', 'Thriller']"
The Highwaymen,movie,2019-03-15,2.7715,"In 1934, Frank Hamer and Manny Gault, two former Texas Rangers, are commissioned to put an end to the wave of vicious crimes perpetrated by Bonnie Parker and Clyde Barrow, a notorious duo of infamous robbers and cold-blooded killers who nevertheless are worshiped by the public.",en,2101,2019,"['Crime', 'Drama', 'Thriller']"
The Perfect Date,movie,2019-04-12,2.7074,"No beau? No problem! To earn money for college, a high schooler creates a dating app that lets him act as a stand-in boyfriend.",en,3265,2019,"['Romance', 'Comedy']"
The Laundromat,movie,2019-09-27,2.5824,"When a widow gets swindled out of insurance money, her search for answers leads to two cunning lawyers in Panama who hide cash for the superrich.",en,1233,2019,"['Crime', 'Drama', 'Comedy']"
I Am Mother,movie,2019-06-07,2.4336,"A teenage girl is raised underground by a robot ""Mother"", designed to repopulate the earth following an extinction event. But their unique bond is threatened when an inexplicable stranger arrives with alarming news.",en,2629,2019,"['Science Fiction', 'Thriller']"
Rim of the World,movie,2019-05-24,2.3459,"Stranded at a summer camp when aliens attack the planet, four teens with nothing in common embark on a perilous mission to save the world.",en,976,2019,"['Science Fiction', 'Adventure', 'Action', 'Comedy']"
Velvet Buzzsaw,movie,2019-02-01,2.3383,"Big money artists and mega-collectors pay a high price when art collides with commerce. After a series of paintings by an unknown artist are discovered, a supernatural force enacts revenge on those who have allowed their greed to get in the way of art.",en,1909,2019,"['Thriller', 'Mystery', 'Horror']"
Secret Obsession,movie,2019-07-18,2.3292,"Newlywed Jennifer is brutally attacked at a dark rest stop. While healing from her injuries, she can’t recall anything from her past, including the ordeal. Her husband, Russell , is just thankful she’s alive and eager to get her home. As he reintroduces her to their secluded mountain estate, Detective Page  pursues Jennifer’s assailant — his own daughter went missing and was never found. The same fate now awaits Jennifer, unless someone realizes that her loving caretaker is actually her captor.",en,1121,2019,"['Drama', 'Thriller', 'Horror']"
Always Be My Maybe,movie,2019-05-31,2.2545,"Reunited after 15 years, famous chef Sasha and hometown musician Marcus feel the old sparks of attraction but struggle to adapt to each other's worlds.",en,1350,2019,"['Romance', 'Comedy']"
The Road to El Camino: Behind the Scenes of El Camino: A Breaking Bad Movie,movie,2019-10-28,2.2452,"Aaron Paul, Vince Gilligan and other cast members, producers and crew share stories and footage from the making of ""El Camino.""",en,20,2019,['Documentary']
Eli,movie,2019-10-18,2.2379,"A boy named Eli with a rare autoimmune disorder is confined to a special experimental clinic for his treatment. He soon begins experiencing supernatural forces, turning the supposedly safe facility into a haunted prison for him and his fellow patients.",en,1430,2019,['Horror']
Falling Inn Love,movie,2019-08-29,2.2323,"When a San Francisco exec wins a New Zealand inn, she ditches city life to remodel and flip the rustic property with help from a handsome contractor.",en,1161,2019,"['Romance', 'Comedy']"
Pets United,movie,2019-11-08,2.1475,"When Roger (a Robin Hood-esque, stray dog) and Belle (an elegant yet spoilt pet cat) are thrown together amidst the chaos of a robot take-over of their home city, they must push all their preconceptions aside in order to survive, as they embark on a high-stakes, action-packed adventure.",en,203,2019,"['Animation', 'Family', 'Adventure', 'Comedy']"
IO,movie,2019-01-18,2.1395,"As a young scientist searches for a way to save a dying Earth, she finds a connection with a man who's racing to catch the last shuttle off the planet.",en,1389,2019,['Science Fiction']
The Knight Before Christmas,movie,2019-11-21,2.1336,A medieval English knight is magically transported to present day where he ends up falling for a high school science teacher.,en,1130,2019,"['Comedy', 'Romance']"
Sextuplets,movie,2019-08-16,2.1086,"Father-to-be Alan is shocked to learn that he was born a sextuplet. With his newfound brother Russell riding shotgun, the duo sets out on a hilarious journey to reunite with their remaining long-lost siblings.",en,850,2019,['Comedy']
Black Christmas,movie,2019-12-11,2.1001,A group of sorority pledges are stalked by a stranger during their Christmas break. That is until the young women discover that the killer is part of an underground campus conspiracy.,en,573,2019,"['Horror', 'Mystery']"
