title,media_type,release_date,popularity,overview,language,vote_count,release_year,genres
Nail Bomber: Manhunt,movie,2021-05-26,0.3855,"This documentary examines the 1999 London bombings that targeted Black, Bangladeshi and gay communities, and the race to find the far-right perpetrator. He terrorized a city, seeking to ignite a race war but justice was served by those who wouldn't let his hate win.",en,48,2021,"['Crime', 'Documentary', 'History']"
Angeliena,movie,2021-10-08,0.3692,"Angeliena’s story is about SELF LOVE... and making money, terminal illness, divorce, nature, friendships, hardships, poverty, travel, hot doctors, plants, dreams, assholes, Ubuntu and... being GOOD ENOUGH.",en,5,2021,"['Family', 'Comedy', 'Drama']"
Mo Amer: Mohammed in Texas,movie,2021-11-30,0.3597,"In his hometown of Houston, Mo Amer takes on pandemic panic, disappointing Bradley Cooper, hummus appropriation and the subtle art of cursing in Arabic.",en,9,2021,['Comedy']
Nate Bargatze: The Greatest Average American,movie,2021-03-18,0.3313,"Tennessee-born comedian, actor, and podcast host Nate Bargatze is back with his second hour-long Netflix original comedy special, Nate Bargatze: The Greatest Average American. Nate reflects on being part of the Oregon Trail generation, meeting his wife while working at Applebee's and the hilariously relatable moments of being a father and husband.",en,28,2021,['Comedy']
A Naija Christmas,movie,2021-12-16,0.3274,Three sons try to make their mother’s dreams come true by bringing home wives for Christmas.,en,47,2021,"['Comedy', 'Romance']"
Chris Rock Total Blackout: The Tamborine Extended Cut,movie,2021-01-12,0.325,"Chris Rock takes the stage filled with searing observations on fatherhood, infidelity and politics.",en,5,2021,"['Comedy', 'TV Movie', 'Documentary']"
Shadow and Bone - The Afterparty,movie,2021-04-24,0.3124,"Stars of Netflix's ""Shadow and Bone"" discuss the show's epic combat scenes, answer some fan questions and play an ""Army vs. Crows"" trivia game.",en,7,2021,[]
Jim Gaffigan: Comedy Monster,movie,2021-12-21,0.2971,"Comedy icon Jim Gaffigan offers some thoughts on the hot mess that was 2021, as well as his takes on marching bands, billionaires in space and more.",en,26,2021,['Comedy']
The Upshaws - The Afterparty,movie,2021-05-14,0.2948,"The comedic dream team from ""The Upshaws"" discuss the hit series, share some anecdotes from their own upbringings and play a little swag-centric game.",en,7,2021,[]
Convergence: Courage in a Crisis,movie,2021-10-08,0.2892,"Activists and volunteers work through the darkest days of 2020, galvanizing social change amidst chaos as governments start to fail local communities. This epic, globally spanning and deeply passionate documentary serves as a clarion call that great change can be born of crisis.",en,9,2021,['Documentary']
Audible,movie,2021-04-29,0.2882,Football player Amaree McKenstry-Hall and his Maryland School for the Deaf teammates attempt to defend their winning streak while coming to terms with the tragic loss of a close friend.,en,79,2021,['Documentary']
Brian Regan: On the Rocks,movie,2021-02-23,0.2875,"Brian Regan tackles the big issues weighing on him, including aging, time, obsessive behavior, backpacks on airplanes, ungrateful horses and raisins.",en,17,2021,['Comedy']
LEGO Friends: Holiday Special,movie,2021-11-05,0.2852,"The holidays are coming to Heartlake City, and the LEGO Friends are full of holiday cheer. But can the group stick together after Andrea ditches Mia's holiday shopping plans?",en,5,2021,"['Animation', 'Family']"
You vs. Wild: Out Cold,movie,2021-09-14,0.2846,"After a plane crash leaves Bear with amnesia, he must make choices to save the missing pilot and survive in this high-stakes interactive adventure.",en,21,2021,"['Action', 'Adventure', 'Documentary']"
Nicole Byer: BBW (Big Beautiful Weirdo),movie,2021-12-07,0.2614,"Nicole takes the stage at the Gramercy Theatre for a HOT new set, discussing everything from how she basically is a vegan (she's just doing her part), what she's looking for in a man, and just how crazy this past year-and-a-half has been.",en,15,2021,['Comedy']
Michael Che: Shame the Devil,movie,2021-11-16,0.2583,"Michael Che returns to the stage in Oakland and tackles American patriotism, Black leadership, jealous exes, loose bears, mental health and more.",en,20,2021,['Comedy']
Theo Von: Regular People,movie,2021-10-19,0.2325,"Theo Von shares stories of his most memorable childhood friends, offers tips on how to effectively avoid work, and recounts the time he tried to play matchmaker in his hometown.",en,13,2021,['Comedy']
Phil Wang: Philly Philly Wang Wang,movie,2021-08-10,0.2254,"Phil Wang explores race, romance, politics and his mixed British-Malaysian heritage in this special filmed at the London Palladium.",en,11,2021,['Comedy']
Making The Billion Dollar Code,movie,2021-10-07,0.2108,"In this featurette, ART + COM members join the cast and crew of the show to discuss its factual basis and the development of the court case.",en,6,2021,['Documentary']
The Witcher: Fireplace,movie,2021-12-17,0.1778,"After keeping many a Witcher warm in the Great Hall at Kaer Morhen, these soothing flames offer a perfect backdrop for a cozy vibe. Fire magic, indeed.",en,11,2021,['Documentary']
Searching for Sheela,movie,2021-04-22,0.147,Journalists and fans await Ma Anand Sheela as the infamous former Rajneesh commune's spokesperson returns to India after decades for an interview tour.,en,23,2021,['Documentary']
The Witcher Season One Recap: From the Beginning,movie,2021-12-17,0.1327,"From Yennefer's magical origins to Geralt's first meeting with Ciri, the events on the Continent unfold in chronological order in this Season 1 rundown.",en,10,2021,[]
Blonde,movie,2022-09-16,28.7258,"From her volatile childhood as Norma Jeane, through her rise to stardom and romantic entanglements, this reimagined fictional portrait of Hollywood legend Marilyn Monroe blurs the lines of fact and fiction to explore the widening split between her public and private selves.",en,1402,2022,['Drama']
Puss in Boots: The Last Wish,movie,2022-12-07,24.053,"Puss in Boots discovers that his passion for adventure has taken its toll: He has burned through eight of his nine lives, leaving him with only one life left. Puss sets out on an epic journey to find the mythical Last Wish and restore his nine lives.",en,8234,2022,"['Animation', 'Adventure', 'Fantasy', 'Comedy', 'Family']"
Fall,movie,2022-08-11,20.3984,"For best friends Becky and Hunter, life is all about conquering fears and pushing limits. But after they climb 2,000 feet to the top of a remote, abandoned radio tower, they find themselves stranded with no way down. Now Becky and Hunter’s expert climbing skills will be put to the ultimate test as they desperately fight to survive the elements, a lack of supplies, and vertigo-inducing heights",en,4146,2022,['Thriller']
M3GAN,movie,2022-12-28,12.2127,"A brilliant toy company roboticist uses artificial intelligence to develop M3GAN, a life-like doll programmed to emotionally bond with her newly orphaned niece. But when the doll's programming works too well, she becomes overprotective of her new friend with terrifying results.",en,4255,2022,"['Science Fiction', 'Horror']"
Everything Everywhere All at Once,movie,2022-03-24,11.6511,"An aging Chinese immigrant is swept up in an insane adventure, where she alone can save what's important to her by connecting with the lives she could have led in other universes.",en,7080,2022,"['Action', 'Adventure', 'Science Fiction']"
Smile,movie,2022-09-23,11.3853,"After witnessing a bizarre, traumatic incident involving a patient, Dr. Rose Cotter starts experiencing frightening occurrences that she can't explain.",en,3599,2022,"['Horror', 'Mystery']"
After Ever Happy,movie,2022-08-24,10.6766,"As a shocking truth about a couple's families emerges, the two lovers discover they are not so different from each other. Tessa is no longer the sweet, simple, good girl she was when she met Hardin — any more than he is the cruel, moody boy she fell so hard for.",en,1280,2022,"['Romance', 'Drama']"
Babylon,movie,2022-12-22,10.1903,"A tale of outsized ambition and outrageous excess, tracing the rise and fall of multiple characters in an era of unbridled decadence and depravity during Hollywood's transition from silent films to sound films in the late 1920s.",en,3377,2022,"['Drama', 'Comedy']"
Purple Hearts,movie,2022-07-29,8.2384,"An aspiring musician agrees to a marriage of convenience with a soon-to-deploy Marine, but a tragedy soon turns their fake relationship all too real.",en,2680,2022,"['Romance', 'Drama']"
A Man Called Otto,movie,2022-12-28,7.889,"When a lively young family moves in next door, grumpy widower Otto Anderson meets his match in a quick-witted, pregnant woman named Marisol, leading to an unlikely friendship that turns his world upside down.",en,3133,2022,"['Comedy', 'Drama']"
The School for Good and Evil,movie,2022-10-19,7.2745,Best friends Sophie and Agatha navigate an enchanted school for young heroes and villains — and find themselves on opposing sides of the battle between good and evil.,en,1298,2022,"['Fantasy', 'Comedy', 'Adventure', 'Drama']"
Glass Onion: A Knives Out Mystery,movie,2022-11-23,6.856,World-famous detective Benoit Blanc heads to Greece to peel back the layers of a mystery surrounding a tech billionaire and his eclectic crew of friends.,en,5925,2022,"['Comedy', 'Crime', 'Mystery']"
The Whale,movie,2022-12-09,6.8266,A reclusive English teacher suffering from severe obesity attempts to reconnect with his estranged teenage daughter for one last chance at redemption.,en,4191,2022,['Drama']
The Woman King,movie,2022-09-16,6.7258,"The story of the Agojie, the all-female unit of warriors who protected the African Kingdom of Dahomey in the 1800s with skills and a fierceness unlike anything the world has ever seen, and General Nanisca as she trains the next generation of recruits and readies them for battle against an enemy determined to destroy their way of life.",en,2170,2022,"['Action', 'Drama', 'History']"
The Gray Man,movie,2022-07-13,6.3444,"When a shadowy CIA agent uncovers damning agency secrets, he's hunted across the globe by a sociopathic rogue operative who's put a bounty on his head.",en,3841,2022,"['Action', 'Thriller']"
Where the Crawdads Sing,movie,2022-07-14,6.3433,"Abandoned by her family, Kya raises herself all alone in the marshes outside of her small town. When her former boyfriend is found dead, Kya is instantly branded by the local townspeople and law enforcement as the prime suspect for his murder.",en,1991,2022,"['Drama', 'Mystery', 'Romance']"
The Fabelmans,movie,2022-11-11,5.9114,"Growing up in post-World War II era Arizona, young Sammy Fabelman aspires to become a filmmaker as he reaches adolescence, but soon discovers a shattering family secret and explores how the power of films can help him see the truth.",en,2486,2022,['Drama']
Texas Chainsaw Massacre,movie,2022-02-18,5.5805,"After nearly 50 years of hiding, Leatherface returns to terrorize a group of idealistic influencers who accidentally disrupt his carefully shielded world in a remote Texas town.",en,1515,2022,"['Horror', 'Crime', 'Thriller']"
The Adam Project,movie,2022-03-11,5.506,"After accidentally crash-landing in 2022, time-traveling fighter pilot Adam Reed teams up with his 12-year-old self on a mission to save the future.",en,4539,2022,"['Adventure', 'Science Fiction', 'Action', 'Comedy']"
Triangle of Sadness,movie,2022-09-18,5.3231,"A celebrity model couple are invited on a luxury cruise for the uber-rich, helmed by an unhinged, alcoholic captain. What first appears Instagrammable ends catastrophically, leaving the survivors stranded on a desert island in a struggle of hierarchy.",en,2447,2022,"['Comedy', 'Drama']"
Halloween Ends,movie,2022-10-12,5.2548,"Four years after the events of Halloween in 2018, Laurie has decided to liberate herself from fear and rage and embrace life. But when a young man is accused of killing a boy he was babysitting, it ignites a cascade of violence and terror that will force Laurie to finally confront the evil she can’t control, once and for all.",en,1852,2022,"['Horror', 'Thriller']"
Bodies Bodies Bodies,movie,2022-08-05,5.0067,"In an isolated family mansion, a group of rich 20-somethings decides to play Bodies Bodies Bodies, a game where one of them is secretly a ""killer"" while the rest tries to ""escape"". Things take a turn for the worse when real bodies start turning up, setting off a paranoid and dangerous chain of events.",en,1277,2022,"['Horror', 'Comedy', 'Mystery']"
The Sea Beast,movie,2022-06-24,4.977,"When a young girl stows away on the ship of a legendary sea monster hunter, they launch an epic journey into uncharted waters — and make history to boot.",en,1545,2022,"['Animation', 'Adventure', 'Action', 'Family', 'Fantasy']"
Roald Dahl's Matilda the Musical,movie,2022-11-25,4.9055,"An extraordinary young girl discovers her superpower and summons the remarkable courage, against all odds, to help others change their stories, whilst also taking charge of her own destiny. Standing up for what's right, she's met with miraculous results.",en,748,2022,"['Family', 'Comedy', 'Fantasy']"
TÁR,movie,2022-09-23,4.8018,"As celebrated conductor Lydia Tár starts rehearsals for a career-defining symphony, the consequences of her past choices begin to echo in the present.",en,1359,2022,"['Music', 'Drama']"
"Lyle, Lyle, Crocodile",movie,2022-10-07,4.682,"When the Primm family moves to New York City, their young son Josh struggles to adapt to his new school and new friends. All of that changes when he discovers Lyle — a singing crocodile who loves baths, caviar and great music — living in the attic of his new home. But when Lyle’s existence is threatened by evil neighbor Mr. Grumps, the Primms must band together to show the world that family can come from the most unexpected places.",en,610,2022,"['Comedy', 'Family', 'Music']"
Accident Man: Hitman's Holiday,movie,2022-10-14,4.6758,"The Accident Man is back, and this time he must best the top assassins in the world to protect the ungrateful son of a mafia boss, save the life of his only friend and rekindle his relationship with his maniacal father figure.",en,197,2022,"['Action', 'Comedy', 'Crime']"
Devotion,movie,2022-11-23,4.5827,The harrowing true story of two elite US Navy fighter pilots during the Korean War. Their heroic sacrifices would ultimately make them the Navy's most celebrated wingmen.,en,748,2022,"['War', 'Drama', 'Action']"
Enola Holmes 2,movie,2022-11-30,4.4921,"Now a detective-for-hire like her infamous brother, Enola Holmes takes on her first official case to find a missing girl, as the sparks of a dangerous conspiracy ignite a mystery that requires the help of friends — and Sherlock himself — to unravel.",en,1541,2022,"['Adventure', 'Mystery', 'Crime']"
The Invitation,movie,2022-08-24,4.4686,"After the death of her mother, Evie is approached by an unknown cousin who invites her to a lavish wedding in the English countryside. Soon, she realizes a gothic conspiracy is afoot and must fight for survival as she uncovers twisted secrets in her family’s history.",en,870,2022,"['Horror', 'Thriller']"
The 355,movie,2022-01-05,4.4478,"A group of top female agents from American, British, Chinese, Colombian, and German government agencies are drawn together to try and stop an organization from acquiring a deadly weapon to send the world into chaos.",en,1047,2022,"['Action', 'Adventure', 'Thriller']"
Marcel the Shell with Shoes On,movie,2022-06-24,4.3533,"Marcel is an adorable one-inch-tall shell who ekes out a colorful existence with his grandmother Connie and their pet lint, Alan. Once part of a sprawling community of shells, they now live alone as the sole survivors of a mysterious tragedy. When a documentarian discovers them amongst the clutter of his Airbnb, his resulting short film brings Marcel millions of passionate fans, as well as unprecedented dangers and a new hope at finding his long-lost family.",en,615,2022,"['Animation', 'Comedy', 'Drama', 'Family']"
Sniper: Rogue Mission,movie,2022-08-16,4.0719,"When a crooked federal agent is involved in a human sex trafficking ring, Sniper and CIA Rookie Brandon Beckett goes rogue, teaming up with his former allies Homeland Security Agent Zero and assassin Lady Death to uncover the corrupt agent and take down the criminal organization.",en,158,2022,"['Action', 'Thriller', 'Mystery']"
The Man from Toronto,movie,2022-12-23,4.0715,"In a case of mistaken identity, the world’s deadliest assassin, known as the Man from Toronto, and a New York City screw-up are forced to team up after being confused for each other at a rental cabin.",en,421,2022,"['Action', 'Adventure', 'Comedy']"
Guillermo del Toro's Pinocchio,movie,2022-11-09,4.0281,"During the rise of fascism in Mussolini's Italy, a wooden boy brought magically to life struggles to live up to his father's expectations.",en,3067,2022,"['Animation', 'Fantasy', 'Adventure']"
Lady Chatterley's Lover,movie,2022-11-22,4.0246,Unhappily married aristocrat Lady Chatterley begins a torrid affair — and falls deeply in love — with the gamekeeper on her husband's country estate.,en,450,2022,"['Drama', 'Romance']"
I Came By,movie,2022-08-19,3.8254,"A rebellious young graffiti artist, who targets the homes of the wealthy elite, discovers a shocking secret that leads him on a journey endangering himself and those closest to him.",en,745,2022,"['Crime', 'Thriller']"
The Unbearable Weight of Massive Talent,movie,2022-04-20,3.8151,"Creatively unfulfilled and facing financial ruin, Nick Cage must accept a $1 million offer to attend the birthday of a dangerous superfan. Things take a wildly unexpected turn when Cage is recruited by a CIA operative and forced to live up to his own legend, channeling his most iconic and beloved on-screen characters in order to save himself and his loved ones.",en,2176,2022,"['Action', 'Comedy', 'Crime']"
Day Shift,movie,2022-08-12,3.7707,An LA vampire hunter has a week to come up with the cash to pay for his kid's tuition and braces. Trying to make a living these days just might kill him.,en,2044,2022,"['Action', 'Fantasy', 'Horror', 'Comedy', 'Thriller']"
Hustle,movie,2022-06-03,3.7439,"After discovering a once-in-a-lifetime player with a rocky past abroad, a down on his luck basketball scout takes it upon himself to bring the phenom to the States without his team's approval. Against the odds, they have one final shot to prove they have what it takes to make it in the NBA.",en,2636,2022,"['Drama', 'Comedy']"
Interceptor,movie,2022-05-26,3.743,A U.S. Army Captain uses her years of tactical training to save humanity from sixteen nuclear missiles launched at the U.S. as a violent attack threatens her remote missile interceptor station.,en,770,2022,"['Action', 'Thriller', 'Adventure']"
Watcher,movie,2022-06-03,3.7345,"As a serial killer stalks the city, Julia — a young actress who just moved to town with her husband — notices a mysterious stranger watching her from across the street.",en,1020,2022,"['Horror', 'Mystery', 'Thriller']"
Monster High: The Movie,movie,2022-10-06,3.5673,"Clawdeen Wolf, half human and half werewolf, has recently started attending Monster High, a school for monsters in all forms. After quickly befriending her classmates Frankie Stein and Draculaura, Clawdeen feels like she has finally found a place where she can truly be herself, or so she thinks. Soon, a devious plan to destroy Monster High threatens to reveal her real identity and Clawdeen must learn to embrace her true monster heart before it's too late.",en,284,2022,"['Family', 'Fantasy', 'Comedy', 'Adventure']"
Emily the Criminal,movie,2022-08-12,3.3579,"Desperate for income, Emily takes a shady gig buying goods with stolen credit cards supplied by a charismatic middleman named Youcef. Seduced by the quick cash and illicit thrills, they hatch a plan to take their business to the next level.",en,888,2022,"['Crime', 'Drama', 'Thriller']"
Bros,movie,2022-09-30,3.3254,Two emotionally unavailable men attempt a relationship.,en,520,2022,"['Comedy', 'Romance']"
Do Revenge,movie,2022-09-14,3.276,A dethroned queen bee at a posh private high school strikes a secret deal with an unassuming new student to enact revenge on one another’s enemies.,en,904,2022,"['Comedy', 'Thriller', 'Romance']"
The In Between,movie,2022-02-11,3.2026,"After surviving a car accident that took the life of her boyfriend, a teenage girl believes he's attempting to reconnect with her from the after world.",en,784,2022,"['Romance', 'Science Fiction', 'Drama']"
The Boss Baby: Christmas Bonus,movie,2022-12-06,3.155,Christmas Eve takes a twisty turn when the Boss Baby accidentally swaps places with one of Santa's elves and gets stranded at the North Pole.,en,308,2022,"['Animation', 'Family', 'Adventure']"
Vengeance,movie,2022-07-29,3.1355,A journalist and podcaster from New York City travels to West Texas in order to report on the death of a girl he was hooking up with.,en,410,2022,"['Comedy', 'Mystery', 'Thriller']"
Infinite Storm,movie,2022-03-25,3.131,One woman's journey for self-discovery and turns into a harrowing tale of survival.,en,310,2022,"['Thriller', 'Adventure', 'Drama', 'Mystery']"
Whitney Houston: I Wanna Dance with Somebody,movie,2022-12-20,3.0129,"The joyous, emotional, heartbreaking celebration of the life and music of Whitney Houston, the greatest female R&B pop vocalist of all time. Tracking her journey from obscurity to musical superstardom.",en,481,2022,"['Music', 'History', 'Drama']"
Senior Year,movie,2022-05-11,2.8362,A thirty-seven-year-old woman wakes up from a twenty-year coma and returns to the high school where she was once a popular cheerleader to finish her senior year and become prom queen.,en,863,2022,['Comedy']
Breaking,movie,2022-08-25,2.8257,"Desperate for money and running out of options, Marine veteran Brian Brown-Easley holds several people hostage inside a bank, setting the stage for a tense confrontation with police.",en,199,2022,"['Crime', 'Drama', 'Thriller']"
Rise of the Teenage Mutant Ninja Turtles: The Movie,movie,2022-08-04,2.7625,"When a mysterious stranger arrives from the future with a dire warning, Leo is forced to rise and lead his brothers, Raph, Donnie, and Mikey in a fight to save the world from a terrifying alien species.",en,197,2022,"['Animation', 'Action', 'Science Fiction']"
Mr. Harrigan's Phone,movie,2022-10-05,2.7612,"Craig, a young boy living in a small town befriends an older, reclusive billionaire, Mr. Harrigan. The two form a bond over books and an iPhone, but when the man passes away the boy discovers that not everything dead is gone.",en,870,2022,"['Drama', 'Horror', 'Mystery']"
The House,movie,2022-01-14,2.729,"Across different eras, a poor family, an anxious developer and a fed-up landlady become tied to the same mysterious house in this animated dark comedy.",en,1062,2022,"['Animation', 'Drama', 'Comedy', 'Horror', 'Fantasy']"
The Swimmers,movie,2022-11-24,2.681,"From war-torn Syria to the 2016 Rio Olympics, two young sisters embark on a risky voyage, putting their hearts and their swimming skills to heroic use.",en,586,2022,"['Drama', 'History']"
The Good Nurse,movie,2022-10-19,2.6369,"Suspicious that her colleague is responsible for a series of mysterious patient deaths, a nurse risks her own life to uncover the truth.",en,1306,2022,"['Drama', 'Crime', 'Mystery']"
The Wonder,movie,2022-11-02,2.6321,"Haunted by her past, a nurse travels from England to a remote Irish village in 1862 to investigate a young girl's supposedly miraculous fast.",en,859,2022,"['Drama', 'Mystery']"
Me Time,movie,2022-08-26,2.5065,"With his family away, a devoted stay-at-home dad enjoys his first me time in years by joining his hard-partying old friend on a wild birthday adventure.",en,938,2022,['Comedy']
Spiderhead,movie,2022-06-17,2.4986,A prisoner in a state-of-the-art penitentiary begins to question the purpose of the emotion-controlling drugs he's testing for a pharmaceutical genius.,en,1596,2022,"['Science Fiction', 'Thriller']"
The Soccer Football Movie,movie,2022-11-09,2.4789,"When mysterious green slime monsters start popping out of soccer balls, all-star athletes Zlatan Ibrahimović and Megan Rapinoe must team up with their four biggest fans to stop evil scientist ""Weird Al"" Yankovic from stealing their talent.",en,119,2022,"['Animation', 'Comedy', 'Family']"
The Pale Blue Eye,movie,2022-12-22,2.4762,"West Point, New York, 1830. When a cadet at the burgeoning military academy is found hanged with his heart cut out, the top brass summons former New York City constable Augustus Landor to investigate. While attempting to solve this grisly mystery, the reluctant detective engages the help of one of the cadets: a strange but brilliant young fellow by the name of Edgar Allan Poe.",en,1933,2022,"['Thriller', 'Crime', 'Horror', 'Mystery']"
Look Both Ways,movie,2022-08-16,2.4588,"On the night of her college graduation, Natalie's life splits into parallel realities after she takes a pregnancy test. What will life and love bring?",en,676,2022,"['Romance', 'Drama', 'Comedy']"
Armageddon Time,movie,2022-10-28,2.4285,"In 1980, Queens, New York, a young Jewish boy befriends a rebellious African-American classmate to the disapproval of his privileged family and begins to reckon with growing up in a world of inequality and prejudice.",en,458,2022,['Drama']
The Weekend Away,movie,2022-03-03,2.4062,"When her best friend vanishes during a girls' trip to Croatia, Beth races to figure out what happened. But each clue yields another unsettling deception.",en,735,2022,"['Thriller', 'Mystery']"
