title,media_type,release_date,popularity,overview,language,vote_count,release_year,genres
Aftershock: Everest and the Nepal Earthquake,tv,2022-09-14,3.1581,"After a terrible earthquake in Nepal, locals and tourists join forces to face destruction in this gripping docuseries.",en,26,2022,['Documentary']
Teletubbies,tv,2022-11-14,3.1154,The four Teletubbies discover and interact with their world.,en,40,2022,['Kids']
Bad Vegan: Fame. Fraud. Fugitives.,tv,2022-03-16,3.0722,"After marrying a mysterious man who claimed he could make her dog immortal, a celebrated vegan restaurateur finds her life veering off the rails.",en,43,2022,"['Documentary', 'Crime']"
Far from Home,tv,2022-12-16,3.0154,"Through a scholarship to a top school, Ishaya ends up in the luxurious world of the happy few in Nigeria, but a secret threatens not only to put an end to this.",en,138,2022,['Drama']
Love on the Spectrum,tv,2022-05-18,3.0013,"In this romantic docuseries, people on the autism spectrum look for love and navigate the changing world of dating and relationships.",en,32,2022,"['Documentary', 'Reality']"
Keep Sweet: Pray and Obey,tv,2022-06-08,2.9587,"In interviews and rare home video footage, ex-FLDS members share the truth about their isolated community — and the events that pushed them to leave.",en,110,2022,"['Documentary', 'Crime']"
I Just Killed My Dad,tv,2022-08-09,2.9284,"Anthony Templet shot his father and never denied it. But why he did it is a complex question with profound implications. Explore Anthony's psyche prior to the events of June 3, 2019 and the journey of his mental and emotional aftermath.",en,44,2022,['Documentary']
Drink Masters,tv,2022-10-28,2.8961,"Twelve innovative mixologists from around the world infuse, stir and blend through a series of high-stakes cocktail challenges to win a life-changing prize and the title of The Ultimate Drink Master.",en,15,2022,['Reality']
Snack vs Chef,tv,2022-11-30,2.7861,"Twelve chefs channel their inner food scientists to re-create classic snacks and invent their own original treats for a $50,000 prize.",en,9,2022,['Reality']
Medianoche en Asia: Comer · Bailar · Soñar,tv,2022-01-20,2.7859,"Night brings out the most playful side of Asia's metropolises. This docuseries captures the food, drink, music — and night owls who shine in the dark.",en,14,2022,['Documentary']
The Principles of Pleasure,tv,2022-03-22,2.7786,"Sex, joy and modern science converge in this eye-opening series that celebrates the complex world of women's pleasure — and puts stubborn myths to rest.",en,26,2022,['Documentary']
Team Zenko Go,tv,2022-03-15,2.7395,"Every good deed is one for this team of kids. Niah, Ari, Ellie and Jax go undercover to help others and secretly solve the city's problems!",en,17,2022,"['Animation', 'Action & Adventure', 'Kids']"
The Puppet Master: Hunting the Ultimate Conman,tv,2022-01-18,2.725,"This harrowing docuseries explores, a cruel conman masquerading as a British spy manipulates and steals from his victims, leaving ruined families in his wake.",en,113,2022,"['Documentary', 'Crime']"
Blood Sisters,tv,2022-05-05,2.7095,"Connected by a dangerous secret, best friends Sarah and Kemi are forced to flee after a wealthy groom disappears at his own engagement party.",en,130,2022,"['Crime', 'Drama']"
Justice Served,tv,2022-07-29,2.6548,A band of freedom fighters invade the trial of a white police officer who shot a Black man — and a hostage situation unfolds on screens nationwide.,en,30,2022,['Action & Adventure']
Buy My House,tv,2022-09-02,2.4091,"Homeowners from across the US pitch properties for sale to four experienced real estate investors, hoping to make a life-changing deal on the spot.",en,8,2022,['Reality']
Selling The OC,tv,2022-08-24,2.3573,"A fresh set of realtors square off, competing to establish themselves at The Oppenheim Group’s second office on the Orange County coast. Will the pressure prove too much for these agents to handle?",en,16,2022,['Reality']
Chef's Table: Pizza,tv,2022-09-07,2.1819,"Dig into the best pizzas from around the world, prepared by renowned chefs who bake passion, creativity and hard work into every slice.",en,19,2022,['Documentary']
Pirate Gold of Adak Island,tv,2022-06-29,2.1359,Will this expert team unearth legendary pirate treasure? Follow the hunt for buried gold amid the harsh Alaskan wilderness in this documentary series.,en,18,2022,"['Reality', 'Documentary']"
FIFA Uncovered,tv,2022-11-09,2.1319,"From power struggles to global politics, an exploration of FIFA reveals the organization's checkered history — and what it takes to host a World Cup.",en,73,2022,"['Documentary', 'Crime']"
Our Great National Parks,tv,2022-04-13,2.1102,"Narrated by former President Barack Obama, this stunning docuseries shines the spotlight on some of the planet's most spectacular national parks.",en,40,2022,['Documentary']
Cook at all Costs,tv,2022-12-16,2.0673,"In this kitchen contest, home cooks bid on ingredients to create dishes that will impress celebrity guest judges — and win the cash left in their bank.",en,5,2022,['Reality']
28 Days Haunted,tv,2022-10-21,2.017,Three teams each spend 28 days in some of America's most haunted locations for a paranormal experiment based on the theories of Ed and Lorraine Warren.,en,105,2022,['Reality']
Hype House,tv,2022-01-07,1.8834,"From humble beginnings to overnight fame, these are the stories of the most popular personalities on social media as they come into their own, fall in love and tackle new chapters in their lives.",en,12,2022,['Reality']
Race: Bubba Wallace,tv,2022-02-22,1.7498,"This docuseries follows Bubba Wallace, the only Black driver currently in NASCAR's Cup Series, as he uses his voice and talent to change the sport.",en,8,2022,['Documentary']
Country Queen,tv,2022-07-15,1.5023,"A Nairobi event planner returns to her village after 10 years, where she confronts her past — and a mining company that threatens to destroy her home.",en,21,2022,['Drama']
The Most Hated Man on the Internet,tv,2022-07-27,1.2945,"Determined to remove her daughter's photos from a revenge porn website, a persistent mother launches an online crusade to shut down its cruel founder.",en,72,2022,['Documentary']
Making Fun,tv,2022-03-04,1.2496,Grumpy expert maker Jimmy DiResta fields kids' ideas for delightfully pointless inventions. Then — if he's in the mood — he and his pals build 'em.,en,6,2022,"['Reality', 'Family']"
How To Build a Sex Room,tv,2022-07-08,0.8084,Couples looking for more spice in the bedroom hire luxury interior designer Melanie Rose to create stylish spaces where they can carry out any fantasy they wish.,en,24,2022,['Reality']
Designing Miami,tv,2022-09-21,0.7289,"Eilyn and Ray Jimenez, two designers from Miami are competitors, and a married couple.",en,7,2022,['Reality']
Senzo: Murder of a Soccer Star,tv,2022-04-07,0.4188,"Soccer player Senzo Meyiwa was a national hero before his killing shocked South Africa. Who did it, and why? This docuseries dives into the evidence.",en,6,2022,"['Documentary', 'Crime']"
Snowflake Mountain,tv,2022-06-22,0.204,Hopelessly entitled or simply in need of tough love? Ten spoiled young adults experience nature without a parental safety net in this reality series.,en,17,2022,['Reality']
LEGO Ninjago: Dragons Rising,tv,2023-06-01,61.7794,"After Crystallized, the 16 realms have abruptly fused into a cosmic unstable dystopia. A Spinjitzu Ninja Master trains a new generation of heroes to find Elemental Dragons before the forces of evil exploit that energy to destroy the world.",en,79,2023,"['Animation', 'Kids', 'Action & Adventure']"
FUBAR,tv,2023-05-25,57.8297,"When a father and daughter discover they both secretly work for the CIA, their high-stakes missions get tangled up with awkward family dynamics.",en,426,2023,"['Action & Adventure', 'Drama', 'Comedy']"
LEGO DREAMZzz,tv,2023-05-15,55.8543,A group of kids join a secret agency where they learn to use the power of imagination to journey into the Dream World and create fantastic creations in order to help sleeping children being terrorized by the evil Nightmare King who is bent on conquering the Dream World and invading the Waking World.,en,18,2023,"['Animation', 'Sci-Fi & Fantasy', 'Action & Adventure', 'Kids']"
The Night Agent,tv,2023-03-23,37.3095,"Brought together by a midnight phone call, an FBI agent and a cybersecurity expert must unravel an ever-growing web of political conspiracies.",en,928,2023,"['Action & Adventure', 'Drama', 'Mystery']"
"XO, Kitty",tv,2023-05-18,32.9502,"Teen matchmaker Kitty Song Covey thinks she knows everything there is to know about love. But when she moves halfway across the world to reunite with her long-distance boyfriend, she'll soon realize that relationships are a lot more complicated when it's your own heart on the line.",en,512,2023,"['Comedy', 'Drama']"
My Dad the Bounty Hunter,tv,2023-02-09,25.517,An intergalactic bounty hunter takes dad duty to new extremes when his two kids accidentally hitch a ride with him to outer space and crash his mission.,en,52,2023,"['Action & Adventure', 'Comedy', 'Animation', 'Family', 'Kids']"
ONE PIECE,tv,2023-08-31,25.3378,"With his straw hat and ragtag crew, young pirate Monkey D. Luffy goes on an epic voyage for treasure.",en,1327,2023,"['Action & Adventure', 'Sci-Fi & Fantasy']"
Not Quite Narwhal,tv,2023-06-19,25.3098,Curious little Kelp's been living his whole life as a narwhal... until he finds out he's actually a unicorn. Now he's got two worlds to explore!,en,10,2023,"['Kids', 'Animation']"
The Diplomat,tv,2023-04-20,23.2906,"In the midst of an international crisis, a career diplomat lands in a high-profile job she’s unsuited for, with tectonic implications for her marriage and her political future.",en,305,2023,"['Drama', 'War & Politics']"
The Fall of the House of Usher,tv,2023-10-12,23.2468,"Ruthless siblings Roderick and Madeline Usher have built Fortunato Pharmaceuticals into an empire of wealth, privilege and power. But past secrets come to light when the heirs to the Usher dynasty start dying at the hands of a mysterious woman from their youth.",en,647,2023,"['Mystery', 'Drama']"
Queen Charlotte: A Bridgerton Story,tv,2023-05-04,22.6157,"The story of how the young Queen Charlotte’s marriage to King George sparked both a great love story and a societal shift, creating the world of the Ton inherited by the characters in Bridgerton.",en,574,2023,['Drama']
Mulligan,tv,2023-05-12,22.1248,"In this satirical comedy, when most of Earth is destroyed by aliens, can a few survivors rebuild what’s left of America and form a more perfect union?",en,28,2023,"['Animation', 'Comedy']"
Princess Power,tv,2023-01-30,21.9847,"Princess friends from four different Fruitdoms — Blueberry, Kiwi, Pineapple and Raspberry — spring into action to make their worlds a better place.",en,21,2023,"['Kids', 'Animation']"
Dew Drop Diaries,tv,2023-07-24,21.1476,"From finding lost items to cleaning up messes, three fairies in training love looking after kids in their care as they work toward earning their wings.",en,7,2023,"['Kids', 'Animation', 'Sci-Fi & Fantasy']"
BLUE EYE SAMURAI,tv,2023-11-03,21.0823,"Driven by a dream of revenge against those who made her an outcast in Edo-period Japan, a young warrior cuts a bloody path toward her destiny.",en,563,2023,"['Action & Adventure', 'Animation']"
Scott Pilgrim Takes Off,tv,2023-11-17,19.4435,"Scott Pilgrim meets the girl of his dreams, Ramona Flowers, only to find out her seven evil exes stand in the way of their love.",en,318,2023,"['Animation', 'Action & Adventure', 'Comedy', 'Sci-Fi & Fantasy']"
Castlevania: Nocturne,tv,2023-09-28,19.2976,"As revolution sweeps France, Richter Belmont fights to uphold his family's legacy and prevent the rise of a ruthless, power-hungry vampire ruler.",en,211,2023,"['Animation', 'Sci-Fi & Fantasy', 'Drama']"
BEEF,tv,2023-04-06,19.2751,A road rage incident between two strangers — a failing contractor and an unfulfilled entrepreneur — sparks a feud that brings out their darkest impulses.,en,739,2023,"['Comedy', 'Drama']"
Carol & the End of the World,tv,2023-12-15,18.9115,"As a planetary apocalypse looms, a woman struggling to embrace end-times chaos searches for meaning in her last months on Earth.",en,73,2023,"['Animation', 'Comedy']"
Obliterated,tv,2023-11-30,18.1638,"A special forces team thwarts a deadly plot in Sin City and parties accordingly. But when the real threat emerges, they must sober up to save Las Vegas.",en,169,2023,"['Comedy', 'Action & Adventure', 'Drama']"
Squid Game: The Challenge,tv,2023-11-22,17.4511,"In this reality competition show inspired by ""Squid Game,"" 456 players put their skills to the ultimate test for a life-changing $4.56 million prize.",en,514,2023,['Reality']
Bodies,tv,2023-10-19,17.1444,"One victim, found dead on a London street. Four detectives, in four different time periods, must solve the mystery to protect Britain's future.",en,428,2023,"['Crime', 'Mystery', 'Sci-Fi & Fantasy', 'Drama']"
Unicorn Academy,tv,2023-11-02,16.2648,"When a dark force threatens to destroy Unicorn Island, a brave teen and her five schoolmates must rise up to protect their beloved magical academy.",en,47,2023,"['Sci-Fi & Fantasy', 'Action & Adventure', 'Kids', 'Animation', 'Comedy', 'Family']"
Kaleidoscope,tv,2023-01-01,16.0587,"A master thief and his crew attempt an epic and elaborate heist worth $7 billion dollars — but betrayal, greed and other threats undermine their plans.",en,419,2023,"['Crime', 'Drama']"
Life on Our Planet,tv,2023-10-25,15.9912,"Life's extraordinary journey to conquer, adapt and survive on Earth across billions of years comes alive in this groundbreaking nature docuseries.",en,175,2023,['Documentary']
My Life with the Walter Boys,tv,2023-12-07,15.4978,"When a tragedy disrupts her life, a teen moves in with her guardian's big family in a small town and learns new lessons about love, hope and friendship.",en,245,2023,['Drama']
Captain Fall,tv,2023-07-28,15.0784,"A goofy, gullible sea captain is hired to helm a high-end cruise ship and becomes the perfect fall guy for an illicit smuggling operation.",en,52,2023,"['Comedy', 'Animation']"
Skull Island,tv,2023-06-22,14.9712,"Shipwrecked in the South Pacific, a group of explorers encounter a menagerie of fearsome creatures — including the giant ape who rules the island: Kong.",en,86,2023,"['Animation', 'Action & Adventure', 'Sci-Fi & Fantasy']"
Survival of the Thickest,tv,2023-07-13,14.9035,"Black, plus-size and newly single, Mavis unexpectedly finds herself having to rebuild her life after putting all her eggs in one man's basket, but she's determined to not only survive but thrive with the support of her chosen family.",en,34,2023,"['Comedy', 'Drama']"
Agent Elvis,tv,2023-03-17,14.3932,Elvis Presley trades in his white jumpsuit for a jet pack when he is covertly inducted into a secret government spy program to help battle the dark forces that threaten the country he loves — all while holding down his day job as the King of Rock & Roll.,en,53,2023,"['Animation', 'Comedy', 'Action & Adventure']"
Florida Man,tv,2023-04-13,14.3633,A disgraced cop in debt is forced to return to his home state of Florida for a shady mission only to get swept up in a wild — and deadly — treasure hunt.,en,99,2023,"['Mystery', 'Comedy', 'Drama']"
Unstable,tv,2023-03-30,14.1906,"He's an eccentric biotech genius. His son's a pragmatist living in his shadow. To save the family business, they'll have to work through some issues.",en,69,2023,"['Comedy', 'Drama']"
That '90s Show,tv,2023-01-19,14.0967,"Hello, Wisconsin! It's 1995 and Leia Forman, daughter of Eric and Donna, is visiting her grandparents for the summer where she bonds with a new generation of Point Place kids under the watchful eye of Kitty and the stern glare of Red. Sex, drugs and rock 'n roll never dies, it just changes clothes.",en,180,2023,['Comedy']
Mech Cadets,tv,2023-08-10,13.9508,An underdog teen joins a group of young Cadets who've been chosen to bond with Robo Mechs from space and defend Earth against alien invaders.,en,29,2023,"['Action & Adventure', 'Animation', 'Family']"
Lockwood & Co.,tv,2023-01-27,13.7645,A girl with extraordinary psychic abilities joins two gifted teen boys at a small ghost-hunting agency to fight the many deadly spirits haunting London.,en,267,2023,['Sci-Fi & Fantasy']
Obsession,tv,2023-04-13,12.0788,A respected London surgeon's affair with his son's fiancée turns into an erotic infatuation that threatens to change their lives forever.,en,154,2023,"['Drama', 'Mystery']"
Painkiller,tv,2023-08-10,11.8862,"The causes and consequences of America's opioid epidemic unfold in this drama following its perpetrators, victims and an investigator seeking the truth.",en,170,2023,"['Drama', 'Crime']"
The Romantics,tv,2023-02-14,11.3438,"Featuring archival footage and in-depth celebrity interviews, this docuseries celebrates the life and the legacy of Bollywood filmmaking titan Yash Chopra and his studio.",en,14,2023,['Documentary']
Fatal Seduction,tv,2023-07-07,11.2517,A married professor is pulled into a passionate affair with a younger man that uncovers a path of tragedy and betrayal from those closest to her.,en,69,2023,"['Mystery', 'Crime', 'Drama']"
Who Is Erin Carter?,tv,2023-08-24,11.2392,A British woman's tranquil life in Barcelona spirals out of control when an armed robbery at a supermarket exposes her secret... and violent past.,en,195,2023,"['Action & Adventure', 'Crime', 'Drama']"
Muscles & Mayhem: An Unauthorized Story of American Gladiators,tv,2023-06-28,10.6245,"In the '90s, TV's stunt-filled ""American Gladiators"" thrilled fans. This docuseries explores the show's success — and how it almost ended before it began.",en,27,2023,['Documentary']
Supa Team 4,tv,2023-07-20,10.2828,Four teens are just trying to survive secondary school when an ex-spy recruits them for her superhero team. Their newest assignment? Saving the world.,en,9,2023,"['Action & Adventure', 'Animation']"
All the Light We Cannot See,tv,2023-11-02,9.6651,A blind French girl and a young German soldier's paths collide during WWII.,en,249,2023,['Drama']
The Big Nailed It Baking Challenge,tv,2023-08-04,9.5348,"In this high-stakes ""Nailed It!"" spinoff competition, 10 novice bakers pick up tips from professional coaches while vying for a sweet cash prize.",en,5,2023,['Reality']
Neon,tv,2023-10-19,9.4283,Three friends move from a small town in Florida to Miami with the hopes of making it big in reggaeton music.,en,20,2023,['Comedy']
Everything Now,tv,2023-10-05,9.3907,"After months in recovery for an eating disorder, 16-year-old Mia devises a bucket list of quintessential teen experiences to make up for lost time.",en,44,2023,"['Comedy', 'Drama']"
American Manhunt: The Boston Marathon Bombing,tv,2023-04-12,9.075,"Archive footage, chilling reenactments and exclusive interviews shed new light on a tragedy — and two brothers — that suspended a city in terror.",en,53,2023,[]
Perfect Match,tv,2023-02-14,9.052,Couples who prove their compatibility gain the power to make or break other matches in this strategic and seductive dating competition.,en,24,2023,['Reality']
Captain Laserhawk: A Blood Dragon Remix,tv,2023-10-19,9.0154,"Branded an enemy of the state, a cyborg supersoldier struggles to find a cause worth fighting for in a dystopian society where nothing is what it seems.",en,86,2023,"['Animation', 'Action & Adventure', 'Sci-Fi & Fantasy', 'Comedy', 'Drama']"
Captains of the World,tv,2023-12-30,8.8107,"From the locker room to the pitch, this docuseries offers exclusive access to all 32 teams as they fight for football glory in the 2022 FIFA World Cup.",en,80,2023,['Documentary']
LEGO Friends: The Next Chapter,tv,2023-06-17,8.6248,Take a look inside the walls of Heartlake International High School with a brand-new group of friends.,en,7,2023,"['Family', 'Animation']"
Break Point,tv,2023-01-13,8.5041,Travel alongside some of the world's most talented tennis players as they swing for greatness and Grand Slams through an action-packed season.,en,38,2023,['Documentary']
Outlast,tv,2023-03-10,8.4407,"In the extreme Alaskan wild, 16 survivalists compete for a chance to win a massive cash prize — but these lone wolves must be part of a team to win.",en,19,2023,['Reality']
Wellmania,tv,2023-03-29,8.4198,"When a health crisis forces Liv to rethink her “live fast, die young” attitude, she jumps into a wellness journey to get better — even if it kills her.",en,40,2023,"['Comedy', 'Drama']"
Freeridge,tv,2023-02-02,7.9246,Four teen friends work to reverse a curse after a peculiar old box seems to bring misfortune — and more — into their lives.,en,24,2023,"['Comedy', 'Drama', 'Mystery']"
How to Become a Cult Leader,tv,2023-07-28,7.6453,"Look inside the cult leader's playbook for achieving unconditional love, endless devotion and the power to control people's minds, bodies, and souls.",en,37,2023,"['Documentary', 'Crime']"
Chimp Empire,tv,2023-04-19,7.6398,"A vast community of chimpanzees thrives in a forest in Uganda, navigating complex social politics, family dynamics and dangerous territory disputes.",en,41,2023,['Documentary']
McGREGOR FOREVER,tv,2023-05-17,7.4085,Conor McGregor's brutal strikes and trash-talking swagger made him the UFC's biggest draw. This rousing documentary series follows his dynamic career.,en,50,2023,['Documentary']
Encounters,tv,2023-09-27,7.0072,"Mass UFO sightings from the last 50 years fuel a global mystery in this docuseries featuring eyewitness accounts, expert interviews and new evidence.",en,26,2023,['Documentary']
Quarterback,tv,2023-07-12,6.7951,"Go inside the huddle and into the homes of Patrick Mahomes, Kirk Cousins, and Marcus Mariota in this candid docuseries following their 2022-23 NFL season.",en,33,2023,['Documentary']
Robbie Williams,tv,2023-11-08,6.6587,"After 25 years of his record-breaking solo career, Robbie looks back on his younger self and reflects on a lifetime spent in the spotlight.",en,32,2023,['Documentary']
Kitti Katz,tv,2023-05-18,6.6321,Three teenage girls transform into fierce feline superheroes to save the world from an evil Egyptian goddess — and still have time for soccer practice.,en,15,2023,"['Animation', 'Action & Adventure']"
MH370: The Plane That Disappeared,tv,2023-03-08,6.5157,"In 2014, a plane with 239 people aboard vanishes from all radar. This docuseries delves into one of our greatest modern mysteries: Flight MH370.",en,138,2023,['Documentary']
The Amazing Digital Circus,tv,2023-10-13,6.3332,A woman is caught in a bizarre virtual reality where she and other trapped humans become bound to the whims of an unhinged AI ringmaster.,en,85,2023,"['Animation', 'Comedy', 'Mystery', 'Sci-Fi & Fantasy']"
World War II: From the Frontlines,tv,2023-12-07,6.214,"Through vividly enhanced archival footage and voices from all sides of the conflict, this docuseries brings WWII to life like never before.",en,81,2023,"['Documentary', 'War & Politics']"
Glamorous,tv,2023-06-22,6.0483,Aspiring influencer Marco lands a dream job with a makeup mogul and begins a dazzling journey of self-discovery amid work chaos and romantic challenges.,en,38,2023,"['Drama', 'Comedy']"
Unseen,tv,2023-03-29,5.9728,A house cleaner desperately searches for her husband as a dreaded criminal syndicate dredges up past tragedies and ultimately drives her to violence.,en,41,2023,"['Crime', 'Drama']"
Working: What We Do All Day,tv,2023-05-17,5.8396,"For some, it's a paycheck. For others, it's a calling. This docuseries explores the meaning of work for modern Americans in a time of rapid change.",en,11,2023,['Documentary']
Madoff: The Monster of Wall Street,tv,2023-01-04,4.9923,"This docuseries follows the rise and fall of financier Bernie Madoff, who orchestrated one of the biggest Ponzi schemes in Wall Street history.",en,53,2023,"['Documentary', 'Crime']"
Miseducation,tv,2023-09-15,4.9609,"After a public humiliation, a wannabe influencer enrolls in a small-town university, where she aspires to regain her social status.",en,8,2023,"['Comedy', 'Drama']"
King of Collectibles: The Goldin Touch,tv,2023-04-28,4.9472,Ken Goldin and his smart team lead the action in this series that takes a look inside a leading auction house specializing in rare collectibles.,en,9,2023,['Reality']
Wrestlers,tv,2023-09-13,4.6873,"At a storied professional wrestling organization, new owners and a roster of rising stars strive to make an impact beyond the ring in this docuseries.",en,16,2023,['Documentary']
Murdaugh Murders: A Southern Scandal,tv,2023-02-22,4.6103,Shocking tragedies shatter a tight-knit South Carolina community and expose the horrifying secrets of its most powerful family.,en,49,2023,"['Documentary', 'Crime']"
Live to 100: Secrets of the Blue Zones,tv,2023-08-30,4.5237,Travel around the world with author Dan Buettner to discover five unique communities where people live extraordinarily long and vibrant lives.,en,31,2023,"['Documentary', 'Mystery']"
Waco: American Apocalypse,tv,2023-03-22,4.5235,This docuseries includes never-before-seen material from the infamous 51-day standoff between federal agents and a heavily armed religious group in 1993.,en,61,2023,"['Documentary', 'Crime']"
How to Become a Mob Boss,tv,2023-11-14,4.5119,This darkly satirical how-to guide explores the rise and fall of history's most notorious mob bosses and their tactics for success.,en,33,2023,['Documentary']
Big Vape: The Rise and Fall of Juul,tv,2023-10-11,4.1669,"In this docuseries, a scrappy electronic cigarette startup becomes a multibillion-dollar company until an epidemic causes its success to go up in smoke.",en,18,2023,['Documentary']
Spy Ops,tv,2023-09-08,4.11,"Intelligence operatives from MI6 to the CIA share insider stories of spy craft, Cold War campaigns, and coups carried out by covert agents.",en,19,2023,"['Documentary', 'Crime']"
