title,media_type,release_date,popularity,overview,language,vote_count,release_year,genres
Big Mouth,tv,2017-09-29,62.5925,Teenage friends find their lives upended by the wonders and horrors of puberty in this edgy comedy from real-life pals Nick Kroll and Andrew Goldberg.,en,1123,2017,"['Comedy', 'Animation']"
13 Reasons Why,tv,2017-03-31,55.3232,"After a teenage girl's perplexing suicide, a classmate receives a series of tapes that unravel the mystery of her tragic choice.",en,4310,2017,"['Drama', 'Mystery']"
Ozark,tv,2017-07-21,47.7535,"A financial adviser drags his family from Chicago to the Missouri Ozarks, where he must launder $500 million in five years to appease a drug boss.",en,2467,2017,"['Crime', 'Drama']"
A Series of Unfortunate Events,tv,2017-01-13,34.674,"The orphaned Baudelaire children face trials, tribulations and the evil Count Olaf, all in their quest to uncover the secret of their parents' death.",en,930,2017,"['Action & Adventure', 'Family', 'Comedy', 'Mystery']"
Atypical,tv,2017-08-11,31.4947,"Sam, an 18-year-old on the autism spectrum, takes a funny, yet painful, journey of self-discovery for love and independence and upends his family.",en,1132,2017,"['Drama', 'Comedy']"
MINDHUNTER,tv,2017-10-13,31.474,An agent in the FBI's Elite Serial Crime Unit develops profiling techniques as he pursues notorious serial killers and rapists.,en,2633,2017,"['Drama', 'Crime']"
One Day at a Time,tv,2017-01-06,31.1859,"In a reimagining of the TV classic, a newly single Latina mother raises her teen daughter and tween son with the ""help"" of her old-school mom.",en,176,2017,['Comedy']
Castlevania,tv,2017-07-07,30.6386,A vampire hunter fights to save a besieged city from an army of otherworldly beasts controlled by Dracula himself.,en,1398,2017,"['Animation', 'Sci-Fi & Fantasy', 'Drama']"
Dear White People,tv,2017-04-28,30.3633,"At a predominantly white Ivy League college, a diverse group of students navigate various forms of racial and other types of discrimination.",en,175,2017,"['Comedy', 'Drama']"
GLOW,tv,2017-06-23,30.0002,"In 1980s LA, a crew of misfits reinvent themselves as the Gorgeous Ladies of Wrestling.",en,397,2017,"['Comedy', 'Drama']"
Santa Clarita Diet,tv,2017-02-03,28.491,They're ordinary husband and wife realtors until she undergoes a dramatic change that sends them down a road of death and destruction. In a good way.,en,731,2017,"['Comedy', 'Mystery', 'Crime']"
Bill Nye Saves the World,tv,2017-04-21,20.3201,"Bill Nye explores science and its impact on politics, society and pop culture. Each episode tackles a topic from a scientific point of view, dispelling myths, and refuting anti-scientific claims that may be espoused by politicians, religious leaders or titans of industry.",en,54,2017,"['Reality', 'Talk', 'Documentary']"
American Vandal,tv,2017-09-15,19.5018,A true-crime satire that explores the aftermath of a costly high school prank that left twenty-seven faculty cars vandalized with phallic images.,en,306,2017,"['Comedy', 'Crime']"
Girlboss,tv,2017-04-21,18.8073,"Sophia is a rebellious, broke anarchist who refuses to grow up. She stumbles upon her passion of selling vintage clothes online and becomes an unlikely businesswoman. As she builds her retail fashion empire, she realizes the value and the difficulty of being the boss of her own life.",en,159,2017,['Comedy']
Friends from College,tv,2017-07-14,17.8333,"Twenty years after graduation, a tight-knit group of college friends reconnects and discovers that love hasn't gotten easier with age.",en,108,2017,['Comedy']
True and the Rainbow Kingdom,tv,2017-08-11,17.6434,"When something's wrong in the Rainbow Kingdom, bighearted guardian True and her best friend, Bartleby, are there to grant wishes and save the day.",en,20,2017,"['Animation', 'Kids', 'Comedy']"
She's Gotta Have It,tv,2017-11-23,16.6883,"Nola Darling struggles to define herself and divide her time among her friends, job and three lovers. A new take on Spike Lee's film, in 10 episodes.",en,54,2017,['Comedy']
Greenhouse Academy,tv,2017-09-08,16.6418,"When teen siblings Hayley and Alex enter an elite boarding school, they find rivalry, romance and a mystery related to the recent loss of their mom.",en,150,2017,['Drama']
Spirit: Riding Free,tv,2017-09-09,16.5588,"In a small Western town, spunky ex-city girl Lucky forms a tight bond with wild horse Spirit while having adventures with best pals Pru and Abigail.",en,40,2017,"['Kids', 'Animation']"
Wet Hot American Summer: Ten Years Later,tv,2017-08-04,16.4227,"A decade after their wild summer as junior counselors, the gang reunites for a weekend of bonding, hanky-panky and hair-raising adventures.",en,116,2017,['Comedy']
Godless,tv,2017-11-22,16.3055,"A ruthless outlaw terrorizes the West in search of a former member of his gang, who’s found a new life in a quiet town populated only by women.",en,615,2017,"['Western', 'Drama']"
Disjointed,tv,2017-08-25,15.6119,Pot activist Ruth Whitefeather Feldman runs a medical marijuana dispensary while encouraging her loyal patients to chill out and enjoy the high life.,en,113,2017,['Comedy']
Gypsy,tv,2017-06-30,14.5374,The journey of Jean Holloway – a therapist who begins to develop dangerous and intimate relationships with the people in her patients' lives.,en,198,2017,['Drama']
Abstract: The Art of Design,tv,2017-02-10,13.7242,Step inside the minds of the most innovative designers in a variety of disciplines and learn how design impacts every aspect of life.,en,71,2017,['Documentary']
Super Monsters,tv,2017-10-13,12.3184,Preschool kids whose parents are the world's most famous monsters try to master their special powers while preparing for kindergarten.,en,44,2017,"['Animation', 'Kids', 'Comedy']"
Wormwood,tv,2017-12-15,12.0549,"In this genre-bending tale, Errol Morris explores the mysterious death of a U.S. scientist entangled in a secret Cold War program known as MK-Ultra.",en,22,2017,"['Documentary', 'Crime', 'Drama']"
Ultimate Beastmaster,tv,2017-02-24,11.8024,"In this intense obstacle course series, elite athletes from the U.S. and other countries compete for cash prizes, individual glory and national pride.",en,35,2017,"['Action & Adventure', 'Reality']"
The Magic School Bus Rides Again,tv,2017-09-29,11.1508,Ms. Frizzle's sister takes her class on a slew of wild science adventures in this update of the beloved animated show.,en,23,2017,"['Kids', 'Animation']"
Trump: An American Dream,tv,2017-11-09,10.4339,"Friends, associates and critics reveal the truly American story of Donald Trump, the brash businessman who defied the odds to become U.S. president.",en,39,2017,['Documentary']
Neo Yokio,tv,2017-09-22,9.8632,"Joined by his faithful mecha-butler, Kaz Kaan pursues love, fashion and supernatural forces amid Neo Yokio's sinister high society.",en,51,2017,"['Animation', 'Action & Adventure', 'Sci-Fi & Fantasy', 'Comedy']"
The Standups,tv,2017-07-04,9.3855,"Comedy's freshest voices take the stage in LA for six half-hour specials packed with sly jokes, hilarious anecdotes and awkward confessions.",en,26,2017,['Comedy']
The Toys That Made Us,tv,2017-12-22,8.9055,The minds behind history's most iconic toy franchises discuss the rise -- and sometimes fall -- of their billion-dollar creations.,en,86,2017,['Documentary']
Stretch Armstrong & the Flex Fighters,tv,2017-11-16,8.8544,"When overscheduled teenager Jake Armstrong and his two best friends are accidentally exposed to an experimental chemical, they become Stretch Armstrong and the Flex Fighters, a team of unlikely superheroes who expand beyond the confines of their lives and embark on a series of adventures.",en,7,2017,"['Animation', 'Action & Adventure']"
LEGO Elves: Secrets of Elvendale,tv,2017-09-01,8.4971,"Armed with a powerful amulet, a teenage guardian is tasked with protecting her little sister -- and all of Elvendale. Based on the popular web series.",en,31,2017,"['Animation', 'Kids', 'Sci-Fi & Fantasy', 'Family']"
The Keepers,tv,2017-05-19,8.427,This docuseries examines the decades-old murder of Sister Catherine Cesnik and its suspected link to a priest accused of abuse.,en,169,2017,"['Documentary', 'Mystery', 'Crime']"
Free Rein,tv,2017-06-22,8.2544,"A 15-year-old from LA spends the summer at her mom's childhood home on an island off the coast of England, where she bonds with a mysterious horse.",en,204,2017,"['Family', 'Kids', 'Drama']"
Jack Whitehall: Travels with My Father,tv,2017-09-22,8.0283,"Comic Jack Whitehall invites his stodgy, unadventurous father to travel with him to odd locations and events in an attempt to strengthen their bond.",en,52,2017,"['Comedy', 'Reality']"
Edgar Rice Burroughs' Tarzan and Jane,tv,2017-01-05,7.5946,"Saved from a plane crash and given supernatural powers, teen Tarzan joins forces with brave city girl Jane to protect his jungle home from threats.",en,19,2017,"['Action & Adventure', 'Animation']"
Buddy Thunderstruck,tv,2017-03-10,7.07,"Follow the outrageous, high-octane adventures of Buddy Thunderstruck, a truck-racing dog who brings guts and good times to the town of Greasepit.",en,13,2017,"['Comedy', 'Animation', 'Family']"
Julie's Greenroom,tv,2017-03-17,6.9353,Ms. Julie teaches performing arts workshops with the help of her assistant Gus at their Wellspring Center for the Performing Arts.,en,10,2017,"['Family', 'Kids']"
The Day I Met El Chapo: The Kate del Castillo Story,tv,2017-10-20,6.6619,"Mexican superstar actress Kate del Castillo reveals the untold story of her encounter with El Chapo Guzmán, the world’s most-wanted drug lord.",en,23,2017,['Documentary']
The Confession Tapes,tv,2017-09-08,5.6428,"This true crime documentary series investigates cases where people convicted of murder claim their confessions were coerced, involuntary or false.",en,52,2017,['Documentary']
13 Reasons Why: Beyond the Reasons,tv,2017-03-31,4.8866,"Cast members, writers, producers and mental health professionals discuss some of the difficult issues and themes explored in ""13 Reasons Why.""",en,33,2017,['Talk']
Hot Girls Wanted: Turned On,tv,2017-04-21,4.528,"Porn has gone mainstream; the question is, can we handle it? This exploration of the intersection of sex and technology is told through the stories of the people whose lives are defined by the current explosion of internet porn-whether they're creating it, consuming it, or both.",en,37,2017,['Documentary']
Trailer Park Boys: Out of the Park: USA,tv,2017-11-24,3.723,"The boys are back on the loose as Bubbles, Julian and Ricky head south of the Canadian border for some outrageous American adventures.",en,10,2017,['Comedy']
Five Came Back,tv,2017-03-31,2.8851,Five acclaimed contemporary directors tell the story of five legendary Hollywood filmmakers who enlisted in the armed forces to document World War II.,en,62,2017,"['Documentary', 'War & Politics']"
Fire Chasers,tv,2017-09-08,2.4123,"As California's 2016 fire season rages, brave backcountry firefighters race to put out the flames, protect homes and save lives in this docuseries.",en,11,2017,['Documentary']
Ari Shaffir: Double Negative,tv,2017-07-18,2.3251,"Wry yet thoughtful, comedian Ari Shaffir brings his edgy humor to two fast-paced stand-up specials about children and adulthood.",en,22,2017,['Comedy']
Dave Chappelle,tv,2017-03-21,2.1123,"Comedy icon Dave Chappelle makes his triumphant return to the screen with a pair of blistering, fresh stand-up specials.",en,43,2017,['Comedy']
Shot in the Dark,tv,2017-11-17,1.7106,"Three rival freelance stringers scour the streets at night to film crime scenes, fires, accidents -- and anything else they can sell to news outlets.",en,29,2017,"['Reality', 'Documentary']"
Daughters of Destiny,tv,2017-07-28,1.5172,Five girls from India's most impoverished families attend a boarding school designed to create opportunities as they strive for a brighter future.,en,14,2017,['Documentary']
72 Dangerous Animals: Latin America,tv,2017-12-05,1.0862,"Powerful cats, indestructible arachnids and flesh-melting pit vipers are just the beginning in this series about Latin America's deadliest creatures.",en,16,2017,['Documentary']
Dope,tv,2017-12-22,0.9289,"Filmed from the perspectives of dealers, users and the police, this vivid series offers a bracing look at the war on drugs.",en,26,2017,"['Documentary', 'Crime', 'War & Politics']"
You,tv,2018-09-09,97.713,"A dangerously charming, intensely obsessive young man goes to extreme measures to insert himself into the lives of those he is transfixed by.",en,3521,2018,['Crime']
The Epic Tales of Captain Underpants,tv,2018-07-13,86.6938,Fourth-grade friends George and Harold have a shared love of pranks and comic books -- and turning their principal into an undies-wearing superhero.,en,66,2018,"['Comedy', 'Kids', 'Animation']"
Cobra Kai,tv,2018-05-02,77.6718,"This Karate Kid sequel series picks up 30 years after the events of the 1984 All Valley Karate Tournament and finds Johnny Lawrence on the hunt for redemption by reopening the infamous Cobra Kai karate dojo. This reignites his old rivalry with the successful Daniel LaRusso, who has been working to maintain the balance in his life without mentor Mr. Miyagi.",en,6618,2018,"['Action & Adventure', 'Drama', 'Comedy']"
She-Ra and the Princesses of Power,tv,2018-11-13,60.6101,"In this reboot of the '80s series, a magic sword transforms an orphan girl into warrior She-Ra, who unites a rebellion to fight against evil.",en,756,2018,"['Animation', 'Kids', 'Sci-Fi & Fantasy']"
Manifest,tv,2018-09-24,58.8968,"After landing from a turbulent but routine flight, the crew and passengers of Montego Air Flight 828 discover five years have passed in what seemed like a few hours. As their new realities become clear, a deeper mystery unfolds and some of the returned passengers soon realize they may be meant for something greater than they ever thought possible.",en,1653,2018,"['Sci-Fi & Fantasy', 'Mystery', 'Drama']"
Lost in Space,tv,2018-04-13,43.9472,"After crash-landing on an alien planet, the Robinson family fights against all odds to survive and escape. But they're surrounded by hidden dangers.",en,1709,2018,"['Sci-Fi & Fantasy', 'Action & Adventure', 'Drama']"
Disenchantment,tv,2018-08-17,42.6634,"Set in a ruined medieval city called Dreamland, Disenchantment follows the grubby adventures of a hard-drinking princess, her feisty elf companion and her personal demon.",en,1176,2018,"['Animation', 'Comedy', 'Action & Adventure', 'Sci-Fi & Fantasy']"
The Dragon Prince,tv,2018-09-14,41.656,An extraordinary discovery inspires two human princes and an elven assassin to team up on an epic quest to bring peace to their warring lands.,en,638,2018,"['Animation', 'Action & Adventure', 'Sci-Fi & Fantasy']"
Chilling Adventures of Sabrina,tv,2018-10-26,41.0308,"As her 16th birthday nears, Sabrina must choose between the witch world of her family and the human world of her friends. Based on the Archie comic.",en,3605,2018,"['Mystery', 'Sci-Fi & Fantasy', 'Drama']"
The Boss Baby: Back in Business,tv,2018-04-06,39.7973,"With a little help from his brother and accomplice, Tim, Boss Baby tries to balance family life with his job at Baby Corp headquarters.",en,1756,2018,"['Animation', 'Action & Adventure', 'Comedy', 'Kids']"
Patriot Act with Hasan Minhaj,tv,2018-10-28,33.7826,"Every Sunday, Hasan Minhaj brings an incisive and nuanced perspective to global news, politics and culture in his unique comedy series.",en,58,2018,"['Comedy', 'Talk']"
Trolls: The Beat Goes On!,tv,2018-01-19,30.7735,"Queen Poppy tries to keep Troll Village's peace with the Bergens by inviting them to parties, playing their sports and preventing crime.",en,49,2018,"['Animation', 'Comedy', 'Family']"
Harvey Street Kids,tv,2018-06-29,29.2096,"Kids rule in a place called Harvey Street, where a trio of girls right wrongs, ice cream is always an option, and every day feels like Saturday.",en,11,2018,"['Animation', 'Comedy', 'Family', 'Kids', 'Action & Adventure']"
My Next Guest Needs No Introduction With David Letterman,tv,2018-01-12,28.5223,Late-night TV legend David Letterman hosts an intimate talk show featuring insightful conversations and fun-filled excursions with notable figures.,en,59,2018,"['Talk', 'Comedy']"
Alexa & Katie,tv,2018-03-23,28.4295,Lifelong best friends Alexa and Katie are eagerly anticipating the start of their freshman year of high school. The pals confront a crisis that leaves them feeling like outsiders at a time when what seems to matter most is fitting in.,en,203,2018,['Comedy']
Narcos: Mexico,tv,2018-11-16,27.996,See the rise of the Guadalajara Cartel as an American DEA agent learns the danger of targeting narcos in 1980s Mexico.,en,1392,2018,"['Drama', 'Crime']"
Insatiable,tv,2018-08-10,25.9406,"A bullied teenager turns to beauty pageants as a way to exact her revenge, with the help of a disgraced coach who soon realizes he's in over his head.",en,1652,2018,"['Drama', 'Comedy']"
Altered Carbon,tv,2018-02-02,25.5859,"After 250 years on ice, a prisoner returns to life in a new body with one chance to win his freedom: by solving a mind-bending murder.",en,2038,2018,"['Sci-Fi & Fantasy', 'Drama']"
The Joel McHale Show with Joel McHale,tv,2018-02-18,24.6615,"Trending news, pop culture, social media, original videos and more come together in host Joel McHale's weekly comedy commentary show.",en,34,2018,"['Comedy', 'Talk']"
3Below: Tales of Arcadia,tv,2018-12-21,22.8874,"After crash-landing on Earth, two royal teen aliens on the run struggle to blend in with humans as they evade intergalactic bounty hunters.",en,124,2018,"['Animation', 'Family', 'Comedy', 'Sci-Fi & Fantasy']"
Paradise PD,tv,2018-08-31,22.2033,"An eager young rookie joins the ragtag small-town police force led by his dad as they bumble, squabble and snort their way through a big drug case.",en,370,2018,"['Comedy', 'Animation']"
Queer Eye,tv,2018-02-07,21.7788,"An all-new “Fab Five” advise men on fashion, grooming, food, culture and design in this modern reboot of the Emmy Award-winning reality series.",en,135,2018,['Reality']
Barbie: Dreamhouse Adventures,tv,2018-05-03,19.818,"Barbie, her sisters, friends and neighbour Ken share vlogs filmed in her Dreamhouse.",en,119,2018,"['Animation', 'Family', 'Kids', 'Comedy']"
Somebody Feed Phil,tv,2018-01-12,19.3013,"""Everybody Loves Raymond"" creator Phil Rosenthal travels the globe to take in the local cuisine and culture of Bangkok, Lisbon, Mexico City and more.",en,38,2018,"['Documentary', 'Reality']"
Explained,tv,2018-05-23,19.2884,"This documentary series, made in partnership with Vox, explain some of the world's current trends, from politics, to science to pop culture.",en,115,2018,['Documentary']
The Kominsky Method,tv,2018-11-16,19.1016,"An aging actor, who long ago enjoyed a brush with fame, makes his living as an acting coach.",en,307,2018,"['Comedy', 'Drama']"
The New Legends of Monkey,tv,2018-01-28,18.1716,Follow a teenage girl and a trio of fallen gods on a perilous journey as they attempt to bring an end to a demonic reign of chaos and restore balance to their world. Inspired by the 16th Century Chinese fable “Journey to the West.”,en,191,2018,"['Sci-Fi & Fantasy', 'Action & Adventure', 'Comedy', 'Drama']"
On My Block,tv,2018-03-16,17.7423,"In a rough Los Angeles neighborhood, four smart, funny and streetwise teens find their lifelong friendship tested as they begin high school.",en,664,2018,['Comedy']
Hilda,tv,2018-09-21,17.2168,"Fearless, free-spirited Hilda finds new friends, adventure and magical creatures when she leaves her enchanted forest home and journeys to the city.",en,182,2018,"['Animation', 'Family', 'Sci-Fi & Fantasy']"
Prince of Peoria,tv,2018-11-16,17.1324,A prankster prince who wants to experience life as an ordinary teen leaves his kingdom to live incognito with a single mom and her studious son.,en,16,2018,"['Comedy', 'Kids']"
The Haunting of Hill House,tv,2018-10-12,16.199,"Flashing between past and present, a fractured family confronts haunting memories of their old home and the terrifying events that drove them from it.",en,2439,2018,"['Mystery', 'Drama']"
Everything Sucks!,tv,2018-02-16,15.7998,"It's 1996 in a town called Boring, Oregon, where high school misfits in the AV and drama clubs brave the ups and downs of teenage emotions in the VHS era.",en,252,2018,"['Drama', 'Comedy']"
The Good Cop,tv,2018-09-21,15.7834,"Honest cop Tony Jr. gets advice from his unscrupulous father, retired NYPD officer Tony Sr., about everything from his job to his love life.",en,54,2018,"['Comedy', 'Drama']"
Maniac,tv,2018-09-21,15.6157,"Two strangers are drawn to a mysterious pharmaceutical trial that will, they're assured, with no complications or side-effects whatsoever, solve all of their problems, permanently. Things do not go as planned.",en,890,2018,"['Comedy', 'Drama', 'Sci-Fi & Fantasy']"
Seven Seconds,tv,2018-02-23,15.2893,Tensions run high between African American citizens and Caucasian cops in Jersey City when a teenage African American boy is critically injured by a cop.,en,134,2018,"['Crime', 'Drama']"
Chip and Potato,tv,2018-10-15,14.9165,"Lovable pug Chip starts kindergarten, makes new friends and tries new things -- with a little help from Potato, her secret mouse pal.",en,25,2018,"['Kids', 'Animation']"
Nailed It!,tv,2018-03-09,14.5869,"Home bakers with a terrible track record take a crack at re-creating edible masterpieces for a $10,000 prize. It's part reality contest, part hot mess.",en,70,2018,['Reality']
Spy Kids: Mission Critical,tv,2018-04-20,14.2194,"In this animated spinoff series, Juni and Carmen Cortez must battle the evil organization S.W.A.M.P. -- without the help of their super-spy parents.",en,43,2018,"['Animation', 'Action & Adventure', 'Kids']"
The Hollow,tv,2018-06-08,13.9183,"Three teens join forces to find a way home after waking up in a strange realm filled with magic portals, perplexing puzzles and vicious beasts.",en,88,2018,"['Animation', 'Kids', 'Drama']"
Tidelands,tv,2018-12-14,13.0257,"Ex-con Cal McTeer's return to her hometown of Orphelin Bay blows the lid off a generations-long conspiracy of silence around murder, drugs and Sirens.",en,104,2018,"['Drama', 'Crime', 'Sci-Fi & Fantasy']"
The Final Table,tv,2018-11-20,12.6786,Team of chefs vie to impress some of the world's toughest palates as they whip up iconic dishes from different nations in this fast-paced competition.,en,36,2018,['Reality']
Medal of Honor,tv,2018-11-09,12.2021,"Honoring service members whose courage merited the awarding of a Medal of Honor, this docudrama series re-creates their inspiring true stories.",en,18,2018,['Documentary']
The A List,tv,2018-10-25,12.097,"Romance, rivalry and radical mystery collide as a group of teens attend a remote island sleepaway camp in this suspenseful, supernatural drama.",en,105,2018,"['Drama', 'Mystery', 'Family']"
Magic for Humans,tv,2018-08-17,12.0299,"From baffling people on the street to orchestrating elaborate tricks, Justin Willman blends good-natured magic with grown-up laughs.",en,54,2018,"['Comedy', 'Reality']"
Dirty Money,tv,2018-01-26,11.9678,"From crippling payday loans to cars that cheat emissions tests, this investigative series exposes brazen acts of corporate greed and corruption.",en,174,2018,"['Crime', 'Documentary']"
Cupcake & Dino - General Services,tv,2018-07-27,11.5401,An enterprising cupcake and his cheerful dinosaur brother take on jobs of all sorts as they work to help friends and strangers in their eccentric city.,en,8,2018,"['Animation', 'Comedy', 'Kids']"
I AM A KILLER,tv,2018-05-29,11.4208,Death row inmates convicted of capital murder give a firsthand account of their crimes in this documentary series.,en,55,2018,"['Documentary', 'Crime']"
Norm Macdonald Has a Show,tv,2018-09-14,11.3518,"Building on their original talk show, comedian Norm Macdonald and sidekick Adam Eget sit down and chat with celebrity guests about their life, career and views in a somewhat unconventional and often irreverent way.",en,31,2018,"['Talk', 'Comedy']"
Best.Worst.Weekend.Ever.,tv,2018-10-19,11.2768,"Teenage friends plan an epic trip to Comic-Con to meet their idol, only to get caught in one hilariously awkward predicament after another.",en,14,2018,['Comedy']
Sugar Rush,tv,2018-07-13,11.037,"A relentlessly fast-paced baking competition that challenges brilliant bakers to create sweet treats that look and taste amazing – all against the clock. Who will race to the finish and win $10,000?",en,75,2018,['Reality']
The Comedy Lineup,tv,2018-07-03,10.8551,A diverse group of up-and-coming comedians perform 15-minute sets in this stand-up comedy showcase series.,en,12,2018,['Comedy']
The Innocents,tv,2018-08-24,10.8436,"When a teenage couple runs away to be together, the extraordinary gift they possess unleashes powerful forces intent on dividing them forever.",en,103,2018,"['Sci-Fi & Fantasy', 'Drama']"
Safe,tv,2018-05-10,10.6407,"After his daughter goes missing, a widower begins uncovering the dark secrets of the people closest to him.",en,312,2018,"['Drama', 'Crime']"
Wild Wild Country,tv,2018-03-16,9.8468,"When a controversial cult leader builds a utopian city in the Oregon desert, conflict with the locals escalates into a national scandal.",en,246,2018,"['Documentary', 'Crime']"
Car Masters: Rust to Riches,tv,2018-09-14,9.7622,"The colorful crew at Gotham Garage overhauls an eclectic collection of cars and trucks, trading up to a showstopper they can sell for big bucks.",en,85,2018,['Reality']
Llama Llama,tv,2018-01-26,9.6526,"Llama, his family and his good friends have heart-warming adventures in a safe, friendly town. An animated show based on the award-winning books.",en,8,2018,"['Animation', 'Kids']"
Bobby Kennedy for President,tv,2018-04-27,9.3228,"Historic footage and leading voices of the era examine the ""Bobby Phenomenon"" of the 1960s and the legacy of the man who helped redefine the country.",en,18,2018,"['Documentary', 'Drama']"
